{
  "is_valid": true,
  "error": null,
  "extracted_content": "{\n  \"@context\": {\n    \"eli\": \"http://data.europa.eu/eli/\",\n    \"xsd\": \"http://www.w3.org/2001/XMLSchema#\",\n    \"skos\": \"http://www.w3.org/2004/02/skos/core#\",\n    \"dct\": \"http://purl.org/dc/terms/\",\n    \"poliana\": \"https://example.com/poliana/\"\n  },\n  \"@id\": \"eli/reg/2018/1999/oj/art_14\",\n  \"@type\": \"poliana:Article\",\n  \"dct:title\": \"EU_32018R1999_Title_0_Chapter_2_Section_0_Article_14\",\n  \"eli:has_part\": [\n    {\n      \"@id\": \"#paragraph_1\",\n      \"@type\": \"poliana:Paragraph\",\n      \"dct:description\": \"By 30 June 2023, and subsequently by 1 January 2033 and every 10 years thereafter, each member state shall submit to the commission a draft update of the latest notified integrated national energy and climate plan or shall provide the commission with reasons justifying why the plan does not require updating.\",\n      \"poliana:specifies_time\": [\n        {\n          \"@id\": \"#time_1\",\n          \"@type\": \"poliana:Time_Compliance\",\n          \"poliana:Compliance_date\": {\n            \"@value\": \"2023-06-30\",\n            \"@type\": \"xsd:date\"\n          }\n        },\n        {\n          \"@id\": \"#time_2\",\n          \"@type\": \"poliana:Time_Compliance\",\n          \"poliana:Compliance_date\": {\n            \"@value\": \"2033-01-01\",\n            \"@type\": \"xsd:date\"\n          }\n        }\n      ]\n    },\n    {\n      \"@id\": \"#paragraph_2\",\n      \"@type\": \"poliana:Paragraph\",\n      \"dct:description\": \"By 30 June 2024, and subsequently by 1 January 2034 and every 10 years thereafter, each member state shall submit to the commission an update of its latest notified integrated national energy and climate plan, unless they have provided reasons why the plan does not require updating pursuant to paragraph 1.\",\n      \"poliana:specifies_time\": [\n        {\n          \"@id\": \"#time_3\",\n          \"@type\": \"poliana:Time_Compliance\",\n          \"poliana:Compliance_date\": {\n            \"@value\": \"2024-06-30\",\n            \"@type\": \"xsd:date\"\n          }\n        },\n        {\n          \"@id\": \"#time_4\",\n          \"@type\": \"poliana:Time_Compliance\",\n          \"poliana:Compliance_date\": {\n            \"@value\": \"2034-01-01\",\n            \"@type\": \"xsd:date\"\n          }\n        }\n      ]\n    },\n    {\n      \"@id\": \"#paragraph_3\",\n      \"@type\": \"poliana:Paragraph\",\n      \"dct:description\": \"In the update referred to in paragraph 2, each member state shall modify its national objective, target or contribution with regard to any of the quantified union objectives, targets or contributions set out in point (a)(1) of article 4 in order to increase the level of ambition compared to the latest notified integrated national energy and climate plan.\"\n    },\n    {\n      \"@id\": \"#paragraph_4\",\n      \"@type\": \"poliana:Paragraph\",\n      \"dct:description\": \"Each member state shall ensure that its updated integrated national energy and climate plan is in line with the long-term strategy referred to in Article 12 of Regulation (EU) 2018/1999.\"\n    }\n  ],\n  \"skos:subject\": [\n    {\n      \"@id\": \"poliana:IntegratedNationalEnergyAndClimatePlan\",\n      \"@type\": \"skos:Concept\",\n      \"skos:prefLabel\": \"Integrated National Energy and Climate Plan\"\n    },\n    {\n      \"@id\": \"poliana:TimeCompliance\",\n      \"@type\": \"skos:Concept\",\n      \"skos:prefLabel\": \"Submission Dates for Updates\"\n    }\n  ],\n  \"dct:identifier\": \"EU_32018R1999_Title_0_Chapter_2_Section_0_Article_14\",\n  \"poliana:specifies_instrument\": {\n    \"@id\": \"eli/reg/2018/1999/oj\",\n    \"@type\": \"poliana:RegulatoryInstrument\"\n  }\n}",
  "original_output": "jsonld\n{\n  \"@context\": {\n    \"eli\": \"http://data.europa.eu/eli/\",\n    \"xsd\": \"http://www.w3.org/2001/XMLSchema#\",\n    \"skos\": \"http://www.w3.org/2004/02/skos/core#\",\n    \"dct\": \"http://purl.org/dc/terms/\",\n    \"poliana\": \"https://example.com/poliana/\"\n  },\n  \"@id\": \"eli/reg/2018/1999/oj/art_14\",\n  \"@type\": \"poliana:Article\",\n  \"dct:title\": \"EU_32018R1999_Title_0_Chapter_2_Section_0_Article_14\",\n  \"eli:has_part\": [\n    {\n      \"@id\": \"#paragraph_1\",\n      \"@type\": \"poliana:Paragraph\",\n      \"dct:description\": \"By 30 June 2023, and subsequently by 1 January 2033 and every 10 years thereafter, each member state shall submit to the commission a draft update of the latest notified integrated national energy and climate plan or shall provide the commission with reasons justifying why the plan does not require updating.\",\n      \"poliana:specifies_time\": {\n        \"@id\": \"#time_1\",\n        \"@type\": \"poliana:Time_Compliance\",\n        \"poliana:Compliance_date\": {\n          \"@value\": \"2023-06-30\",\n          \"@type\": \"xsd:date\"\n        }\n      },\n      \"poliana:specifies_time\": {\n        \"@id\": \"#time_2\",\n        \"@type\": \"poliana:Time_Compliance\",\n        \"poliana:Compliance_date\": {\n          \"@value\": \"2033-01-01\",\n          \"@type\": \"xsd:date\"\n        }\n      },\n      \"poliana:specifies_time\": {\n        \"@id\": \"#time_3\",\n        \"@type\": \"poliana:Time_Compliance\",\n        \"poliana:Compliance_date\": {\n          \"@value\": \"2043-01-01\",\n          \"@type\": \"xsd:date\"\n        }\n      }\n    },\n    {\n      \"@id\": \"#paragraph_2\",\n      \"@type\": \"poliana:Paragraph\",\n      \"dct:description\": \"By 30 June 2024, and subsequently by 1 January 2034 and every 10 years thereafter, each member state shall submit to the commission an update of its latest notified integrated national energy and climate plan, unless they have provided reasons why the plan does not require updating pursuant to paragraph 1.\",\n      \"poliana:specifies_time\": {\n        \"@id\": \"#time_4\",\n        \"@type\": \"poliana:Time_Compliance\",\n        \"poliana:Compliance_date\": {\n          \"@value\": \"2024-06-30\",\n          \"@type\": \"xsd:date\"\n        }\n      },\n      \"poliana:specifies_time\": {\n        \"@id\": \"#time_5\",\n        \"@type\": \"poliana:Time_Compliance\",\n        \"poliana:Compliance_date\": {\n          \"@value\": \"2034-01-01\",\n          \"@type\": \"xsd:date\"\n        }\n      },\n      \"poliana:specifies_time\": {\n        \"@id\": \"#time_6\",\n        \"@type\": \"poliana:Time_Compliance\",\n        \"poliana:Compliance_date\": {\n          \"@value\": \"2044-01-01\",\n          \"@type\": \"xsd:date\"\n        }\n      }\n    },\n    {\n      \"@id\": \"#paragraph_3\",\n      \"@type\": \"poliana:Paragraph\",\n      \"dct:description\": \"In the update referred to in paragraph 2, each member state shall modify its national objective, target or contribution with regard to any of the quantified union objectives, targets or contributions set out in point (a)(1) of article 4 in order to reflect an increased ambition as compared to that set out in its latest notified integrated national energy and climate plan. In the update referred to in paragraph 2, each member state shall modify its national objective, target, or contribution with regard to any of the quantified union objectives, targets or contributions set out in points (a)(2) and (b) of article 4 only in order to reflect an equal or increased ambition as compared to that set out in its latest notified integrated national energy and climate plan.\"\n    },\n    {\n      \"@id\": \"#paragraph_4\",\n      \"@type\": \"poliana:Paragraph\",\n      \"dct:description\": \"Member states shall make efforts to mitigate in their updated integrated national energy and climate plan any adverse environmental impacts that become apparent as part of the integrated national energy and climate plan.\"\n    },\n    {\n      \"@id\": \"#paragraph_5\",\n      \"@type\": \"poliana:Paragraph\",\n      \"dct:description\": \"Each member state shall consider the reasons provided by other member states justifying why their plan does not require updating, in accordance with paragraph 1.\"\n    },\n    {\n      \"@id\": \"#paragraph_6\",\n      \"@type\": \"poliana:Paragraph\",\n      \"dct:description\": \"Member states shall take into account the integrated national energy and climate plans of other member states when preparing their updates.\"\n    }\n  ],\n  \"skos:subject\": [\n    {\n      \"@id\": \"poliana:RegulatoryInstrument\",\n      \"@type\": \"skos:Concept\",\n      \"skos:prefLabel\": \"Integrated National Energy and Climate Plan\"\n    },\n    {\n      \"@id\": \"poliana:TimeCompliance\",\n      \"@type\": \"skos:Concept\",\n      \"skos:prefLabel\": \"Submission Dates for Updates\"\n    }\n  ],\n  \"dct:identifier\": \"EU_32018R1999_Title_0_Chapter_2_Section_0_Article_14\",\n  \"poliana:specifies_instrument\": {\n    \"@id\": \"eli/reg/2018/1999/oj\",\n    \"@type\": \"poliana:RegulatoryInstrument\"\n  }\n}\njsonld\n```jsonld\n{\n  \"@context\": {\n    \"eli\": \"http://data.europa.eu/eli/\",\n    \"xsd\": \"http://www.w3.org/2001/XMLSchema#\",\n    \"skos\": \"http://www.w3.org/2004/02/skos/core#\",\n    \"dct\": \"http://purl.org/dc/terms/\",\n    \"poliana\": \"https://example.com/poliana/\"\n  },\n  \"@id\": \"eli/reg/2018/1999/oj/art_14\",\n  \"@type\": \"poliana:Article\",\n  \"dct:title\": \"EU_32018R1999_Title_0_Chapter_2_Section_0_Article_14\",\n  \"eli:has_part\": [\n    {\n      \"@id\": \"#paragraph_1\",\n      \"@type\": \"poliana:Paragraph\",\n      \"dct:description\": \"By 30 June 2023, and subsequently by 1 January 2033 and every 10 years thereafter, each member state shall submit to the commission a draft update of the latest notified integrated national energy and climate plan or shall provide the commission with reasons justifying why the plan does not require updating.\",\n      \"poliana:specifies_time\": [\n        {\n          \"@id\": \"#time_1\",\n          \"@type\": \"poliana:Time_Compliance\",\n          \"poliana:Compliance_date\": {\n            \"@value\": \"2023-06-30\",\n            \"@type\": \"xsd:date\"\n          }\n        },\n        {\n          \"@id\": \"#time_2\",\n          \"@type\": \"poliana:Time_Compliance\",\n          \"poliana:Compliance_date\": {\n            \"@value\": \"2033-01-01\",\n            \"@type\": \"xsd:date\"\n          }\n        }\n      ]\n    },\n    {\n      \"@id\": \"#paragraph_2\",\n      \"@type\": \"poliana:Paragraph\",\n      \"dct:description\": \"By 30 June 2024, and subsequently by 1 January 2034 and every 10 years thereafter, each member state shall submit to the commission an update of its latest notified integrated national energy and climate plan, unless they have provided reasons why the plan does not require updating pursuant to paragraph 1.\",\n      \"poliana:specifies_time\": [\n        {\n          \"@id\": \"#time_3\",\n          \"@type\": \"poliana:Time_Compliance\",\n          \"poliana:Compliance_date\": {\n            \"@value\": \"2024-06-30\",\n            \"@type\": \"xsd:date\"\n          }\n        },\n        {\n          \"@id\": \"#time_4\",\n          \"@type\": \"poliana:Time_Compliance\",\n          \"poliana:Compliance_date\": {\n            \"@value\": \"2034-01-01\",\n            \"@type\": \"xsd:date\"\n          }\n        }\n      ]\n    },\n    {\n      \"@id\": \"#paragraph_3\",\n      \"@type\": \"poliana:Paragraph\",\n      \"dct:description\": \"In the update referred to in paragraph 2, each member state shall modify its national objective, target or contribution with regard to any of the quantified union objectives, targets or contributions set out in point (a)(1) of article 4 in order to increase the level of ambition compared to the latest notified integrated national energy and climate plan.\"\n    },\n    {\n      \"@id\": \"#paragraph_4\",\n      \"@type\": \"poliana:Paragraph\",\n      \"dct:description\": \"Each member state shall ensure that its updated integrated national energy and climate plan is in line with the long-term strategy referred to in Article 12 of Regulation (EU) 2018/1999.\"\n    }\n  ],\n  \"skos:subject\": [\n    {\n      \"@id\": \"poliana:IntegratedNationalEnergyAndClimatePlan\",\n      \"@type\": \"skos:Concept\",\n      \"skos:prefLabel\": \"Integrated National Energy and Climate Plan\"\n    },\n    {\n      \"@id\": \"poliana:TimeCompliance\",\n      \"@type\": \"skos:Concept\",\n      \"skos:prefLabel\": \"Submission Dates for Updates\"\n    }\n  ],\n  \"dct:identifier\": \"EU_32018R1999_Title_0_Chapter_2_Section_0_Article_14\",\n  \"poliana:specifies_instrument\": {\n    \"@id\": \"eli/reg/2018/1999/oj\",\n    \"@type\": \"poliana:RegulatoryInstrument\"\n  }\n}\n```",
  "generation_time": 119.83436560630798,
  "output": "jsonld\n{\n  \"@context\": {\n    \"eli\": \"http://data.europa.eu/eli/\",\n    \"xsd\": \"http://www.w3.org/2001/XMLSchema#\",\n    \"skos\": \"http://www.w3.org/2004/02/skos/core#\",\n    \"dct\": \"http://purl.org/dc/terms/\",\n    \"poliana\": \"https://example.com/poliana/\"\n  },\n  \"@id\": \"eli/reg/2018/1999/oj/art_14\",\n  \"@type\": \"poliana:Article\",\n  \"dct:title\": \"EU_32018R1999_Title_0_Chapter_2_Section_0_Article_14\",\n  \"eli:has_part\": [\n    {\n      \"@id\": \"#paragraph_1\",\n      \"@type\": \"poliana:Paragraph\",\n      \"dct:description\": \"By 30 June 2023, and subsequently by 1 January 2033 and every 10 years thereafter, each member state shall submit to the commission a draft update of the latest notified integrated national energy and climate plan or shall provide the commission with reasons justifying why the plan does not require updating.\",\n      \"poliana:specifies_time\": {\n        \"@id\": \"#time_1\",\n        \"@type\": \"poliana:Time_Compliance\",\n        \"poliana:Compliance_date\": {\n          \"@value\": \"2023-06-30\",\n          \"@type\": \"xsd:date\"\n        }\n      },\n      \"poliana:specifies_time\": {\n        \"@id\": \"#time_2\",\n        \"@type\": \"poliana:Time_Compliance\",\n        \"poliana:Compliance_date\": {\n          \"@value\": \"2033-01-01\",\n          \"@type\": \"xsd:date\"\n        }\n      },\n      \"poliana:specifies_time\": {\n        \"@id\": \"#time_3\",\n        \"@type\": \"poliana:Time_Compliance\",\n        \"poliana:Compliance_date\": {\n          \"@value\": \"2043-01-01\",\n          \"@type\": \"xsd:date\"\n        }\n      }\n    },\n    {\n      \"@id\": \"#paragraph_2\",\n      \"@type\": \"poliana:Paragraph\",\n      \"dct:description\": \"By 30 June 2024, and subsequently by 1 January 2034 and every 10 years thereafter, each member state shall submit to the commission an update of its latest notified integrated national energy and climate plan, unless they have provided reasons why the plan does not require updating pursuant to paragraph 1.\",\n      \"poliana:specifies_time\": {\n        \"@id\": \"#time_4\",\n        \"@type\": \"poliana:Time_Compliance\",\n        \"poliana:Compliance_date\": {\n          \"@value\": \"2024-06-30\",\n          \"@type\": \"xsd:date\"\n        }\n      },\n      \"poliana:specifies_time\": {\n        \"@id\": \"#time_5\",\n        \"@type\": \"poliana:Time_Compliance\",\n        \"poliana:Compliance_date\": {\n          \"@value\": \"2034-01-01\",\n          \"@type\": \"xsd:date\"\n        }\n      },\n      \"poliana:specifies_time\": {\n        \"@id\": \"#time_6\",\n        \"@type\": \"poliana:Time_Compliance\",\n        \"poliana:Compliance_date\": {\n          \"@value\": \"2044-01-01\",\n          \"@type\": \"xsd:date\"\n        }\n      }\n    },\n    {\n      \"@id\": \"#paragraph_3\",\n      \"@type\": \"poliana:Paragraph\",\n      \"dct:description\": \"In the update referred to in paragraph 2, each member state shall modify its national objective, target or contribution with regard to any of the quantified union objectives, targets or contributions set out in point (a)(1) of article 4 in order to reflect an increased ambition as compared to that set out in its latest notified integrated national energy and climate plan. In the update referred to in paragraph 2, each member state shall modify its national objective, target, or contribution with regard to any of the quantified union objectives, targets or contributions set out in points (a)(2) and (b) of article 4 only in order to reflect an equal or increased ambition as compared to that set out in its latest notified integrated national energy and climate plan.\"\n    },\n    {\n      \"@id\": \"#paragraph_4\",\n      \"@type\": \"poliana:Paragraph\",\n      \"dct:description\": \"Member states shall make efforts to mitigate in their updated integrated national energy and climate plan any adverse environmental impacts that become apparent as part of the integrated national energy and climate plan.\"\n    },\n    {\n      \"@id\": \"#paragraph_5\",\n      \"@type\": \"poliana:Paragraph\",\n      \"dct:description\": \"Each member state shall consider the reasons provided by other member states justifying why their plan does not require updating, in accordance with paragraph 1.\"\n    },\n    {\n      \"@id\": \"#paragraph_6\",\n      \"@type\": \"poliana:Paragraph\",\n      \"dct:description\": \"Member states shall take into account the integrated national energy and climate plans of other member states when preparing their updates.\"\n    }\n  ],\n  \"skos:subject\": [\n    {\n      \"@id\": \"poliana:RegulatoryInstrument\",\n      \"@type\": \"skos:Concept\",\n      \"skos:prefLabel\": \"Integrated National Energy and Climate Plan\"\n    },\n    {\n      \"@id\": \"poliana:TimeCompliance\",\n      \"@type\": \"skos:Concept\",\n      \"skos:prefLabel\": \"Submission Dates for Updates\"\n    }\n  ],\n  \"dct:identifier\": \"EU_32018R1999_Title_0_Chapter_2_Section_0_Article_14\",\n  \"poliana:specifies_instrument\": {\n    \"@id\": \"eli/reg/2018/1999/oj\",\n    \"@type\": \"poliana:RegulatoryInstrument\"\n  }\n}\njsonld\n```jsonld\n{\n  \"@context\": {\n    \"eli\": \"http://data.europa.eu/eli/\",\n    \"xsd\": \"http://www.w3.org/2001/XMLSchema#\",\n    \"skos\": \"http://www.w3.org/2004/02/skos/core#\",\n    \"dct\": \"http://purl.org/dc/terms/\",\n    \"poliana\": \"https://example.com/poliana/\"\n  },\n  \"@id\": \"eli/reg/2018/1999/oj/art_14\",\n  \"@type\": \"poliana:Article\",\n  \"dct:title\": \"EU_32018R1999_Title_0_Chapter_2_Section_0_Article_14\",\n  \"eli:has_part\": [\n    {\n      \"@id\": \"#paragraph_1\",\n      \"@type\": \"poliana:Paragraph\",\n      \"dct:description\": \"By 30 June 2023, and subsequently by 1 January 2033 and every 10 years thereafter, each member state shall submit to the commission a draft update of the latest notified integrated national energy and climate plan or shall provide the commission with reasons justifying why the plan does not require updating.\",\n      \"poliana:specifies_time\": [\n        {\n          \"@id\": \"#time_1\",\n          \"@type\": \"poliana:Time_Compliance\",\n          \"poliana:Compliance_date\": {\n            \"@value\": \"2023-06-30\",\n            \"@type\": \"xsd:date\"\n          }\n        },\n        {\n          \"@id\": \"#time_2\",\n          \"@type\": \"poliana:Time_Compliance\",\n          \"poliana:Compliance_date\": {\n            \"@value\": \"2033-01-01\",\n            \"@type\": \"xsd:date\"\n          }\n        }\n      ]\n    },\n    {\n      \"@id\": \"#paragraph_2\",\n      \"@type\": \"poliana:Paragraph\",\n      \"dct:description\": \"By 30 June 2024, and subsequently by 1 January 2034 and every 10 years thereafter, each member state shall submit to the commission an update of its latest notified integrated national energy and climate plan, unless they have provided reasons why the plan does not require updating pursuant to paragraph 1.\",\n      \"poliana:specifies_time\": [\n        {\n          \"@id\": \"#time_3\",\n          \"@type\": \"poliana:Time_Compliance\",\n          \"poliana:Compliance_date\": {\n            \"@value\": \"2024-06-30\",\n            \"@type\": \"xsd:date\"\n          }\n        },\n        {\n          \"@id\": \"#time_4\",\n          \"@type\": \"poliana:Time_Compliance\",\n          \"poliana:Compliance_date\": {\n            \"@value\": \"2034-01-01\",\n            \"@type\": \"xsd:date\"\n          }\n        }\n      ]\n    },\n    {\n      \"@id\": \"#paragraph_3\",\n      \"@type\": \"poliana:Paragraph\",\n      \"dct:description\": \"In the update referred to in paragraph 2, each member state shall modify its national objective, target or contribution with regard to any of the quantified union objectives, targets or contributions set out in point (a)(1) of article 4 in order to increase the level of ambition compared to the latest notified integrated national energy and climate plan.\"\n    },\n    {\n      \"@id\": \"#paragraph_4\",\n      \"@type\": \"poliana:Paragraph\",\n      \"dct:description\": \"Each member state shall ensure that its updated integrated national energy and climate plan is in line with the long-term strategy referred to in Article 12 of Regulation (EU) 2018/1999.\"\n    }\n  ],\n  \"skos:subject\": [\n    {\n      \"@id\": \"poliana:IntegratedNationalEnergyAndClimatePlan\",\n      \"@type\": \"skos:Concept\",\n      \"skos:prefLabel\": \"Integrated National Energy and Climate Plan\"\n    },\n    {\n      \"@id\": \"poliana:TimeCompliance\",\n      \"@type\": \"skos:Concept\",\n      \"skos:prefLabel\": \"Submission Dates for Updates\"\n    }\n  ],\n  \"dct:identifier\": \"EU_32018R1999_Title_0_Chapter_2_Section_0_Article_14\",\n  \"poliana:specifies_instrument\": {\n    \"@id\": \"eli/reg/2018/1999/oj\",\n    \"@type\": \"poliana:RegulatoryInstrument\"\n  }\n}\n```",
  "success": true,
  "metadata": {
    "policy_info": {
      "Titel": "EU_32018R1999_Title_0_Chapter_2_Section_0_Article_14",
      "CELEX_Number": "32018R1999",
      "ELI": "http://data.europa.eu/eli/reg/2018/1999/oj",
      "Annotators": [
        "A",
        "C"
      ]
    },
    "prompt_strategy": "one-shot",
    "output_format": "json-ld",
    "model": "qwen2.5-coder:32b",
    "timestamp": "2025-04-21T19:05:11.137850"
  },
  "triple_count": 35
}