{
  "zero-shot": {
    "is_valid": false,
    "error": "Expecting value: line 1 column 1 (char 0)",
    "extracted_content": "jsonld\n{\n  \"@context\": {\n    \"dct\": \"http://purl.org/dc/terms/\",\n    \"eli\": \"http://data.europa.eu/eli/ontology#\",\n    \"poliana\": \"https://w3id.org/poliana/ontology#\"\n  },\n  \"@type\": \"eli:Article\",\n  \"eli:title\": {\n    \"@value\": \"EU_32018L2001_Title_0_Chapter_0_Section_0_Article_01\",\n    \"@language\": \"en\"\n  },\n  \"eli:number\": \"1\",\n  \"dct:identifier\": \"32018L2001\",\n  \"eli:hasExpression\": {\n    \"@type\": \"eli:LegalResource\",\n    \"eli:expressionDate\": \"2018-12-11\",\n    \"eli:isVersionOf\": {\n      \"@id\": \"http://data.europa.eu/eli/dir/2018/2001\"\n    },\n    \"dct:format\": \"text/html\",\n    \"eli:expressionPointer\": \"/oj\",\n    \"dct:source\": \"OJ:L:2018:347:TOC\"\n  },\n  \"poliana:hasProvision\": [\n    {\n      \"@type\": \"poliana:Provision\",\n      \"poliana:text\": \"this directive establishes a common framework for the promotion of energy from renewable sources.\",\n      \"dct:language\": \"en\"\n    },\n    {\n      \"@type\": \"poliana:Provision\",\n      \"poliana:text\": \"it sets a binding union target for the overall share of energy from renewable sources in the union's gross final consumption of energy in 2030.\",\n      \"dct:language\": \"en\"\n    },\n    {\n      \"@type\": \"poliana:Provision\",\n      \"poliana:text\": \"it also lays down rules on financial support for electricity from renewable sources, on self-consumption of such electricity, on the use of energy from renewable sources in the heating and cooling sector and in the transport sector, on regional cooperation between member states, and between member states and third countries, on guarantees of origin, on administrative procedures and on information and training.\",\n      \"dct:language\": \"en\"\n    },\n    {\n      \"@type\": \"poliana:Provision\",\n      \"poliana:text\": \"it also establishes sustainability and greenhouse gas emissions saving criteria for biofuels, bioliquids and biomass fuels.\",\n      \"dct:language\": \"en\"\n    }\n  ]\n}\njsonld",
    "original_output": "jsonld\n{\n  \"@context\": {\n    \"dct\": \"http://purl.org/dc/terms/\",\n    \"eli\": \"http://data.europa.eu/eli/ontology#\",\n    \"poliana\": \"https://w3id.org/poliana/ontology#\"\n  },\n  \"@type\": \"eli:Article\",\n  \"eli:title\": {\n    \"@value\": \"EU_32018L2001_Title_0_Chapter_0_Section_0_Article_01\",\n    \"@language\": \"en\"\n  },\n  \"eli:number\": \"1\",\n  \"dct:identifier\": \"32018L2001\",\n  \"eli:hasExpression\": {\n    \"@type\": \"eli:LegalResource\",\n    \"eli:expressionDate\": \"2018-12-11\",\n    \"eli:isVersionOf\": {\n      \"@id\": \"http://data.europa.eu/eli/dir/2018/2001\"\n    },\n    \"dct:format\": \"text/html\",\n    \"eli:expressionPointer\": \"/oj\",\n    \"dct:source\": \"OJ:L:2018:347:TOC\"\n  },\n  \"poliana:hasProvision\": [\n    {\n      \"@type\": \"poliana:Provision\",\n      \"poliana:text\": \"this directive establishes a common framework for the promotion of energy from renewable sources.\",\n      \"dct:language\": \"en\"\n    },\n    {\n      \"@type\": \"poliana:Provision\",\n      \"poliana:text\": \"it sets a binding union target for the overall share of energy from renewable sources in the union's gross final consumption of energy in 2030.\",\n      \"dct:language\": \"en\"\n    },\n    {\n      \"@type\": \"poliana:Provision\",\n      \"poliana:text\": \"it also lays down rules on financial support for electricity from renewable sources, on self-consumption of such electricity, on the use of energy from renewable sources in the heating and cooling sector and in the transport sector, on regional cooperation between member states, and between member states and third countries, on guarantees of origin, on administrative procedures and on information and training.\",\n      \"dct:language\": \"en\"\n    },\n    {\n      \"@type\": \"poliana:Provision\",\n      \"poliana:text\": \"it also establishes sustainability and greenhouse gas emissions saving criteria for biofuels, bioliquids and biomass fuels.\",\n      \"dct:language\": \"en\"\n    }\n  ]\n}\njsonld",
    "generation_time": 26.461976051330566,
    "output": "jsonld\n{\n  \"@context\": {\n    \"dct\": \"http://purl.org/dc/terms/\",\n    \"eli\": \"http://data.europa.eu/eli/ontology#\",\n    \"poliana\": \"https://w3id.org/poliana/ontology#\"\n  },\n  \"@type\": \"eli:Article\",\n  \"eli:title\": {\n    \"@value\": \"EU_32018L2001_Title_0_Chapter_0_Section_0_Article_01\",\n    \"@language\": \"en\"\n  },\n  \"eli:number\": \"1\",\n  \"dct:identifier\": \"32018L2001\",\n  \"eli:hasExpression\": {\n    \"@type\": \"eli:LegalResource\",\n    \"eli:expressionDate\": \"2018-12-11\",\n    \"eli:isVersionOf\": {\n      \"@id\": \"http://data.europa.eu/eli/dir/2018/2001\"\n    },\n    \"dct:format\": \"text/html\",\n    \"eli:expressionPointer\": \"/oj\",\n    \"dct:source\": \"OJ:L:2018:347:TOC\"\n  },\n  \"poliana:hasProvision\": [\n    {\n      \"@type\": \"poliana:Provision\",\n      \"poliana:text\": \"this directive establishes a common framework for the promotion of energy from renewable sources.\",\n      \"dct:language\": \"en\"\n    },\n    {\n      \"@type\": \"poliana:Provision\",\n      \"poliana:text\": \"it sets a binding union target for the overall share of energy from renewable sources in the union's gross final consumption of energy in 2030.\",\n      \"dct:language\": \"en\"\n    },\n    {\n      \"@type\": \"poliana:Provision\",\n      \"poliana:text\": \"it also lays down rules on financial support for electricity from renewable sources, on self-consumption of such electricity, on the use of energy from renewable sources in the heating and cooling sector and in the transport sector, on regional cooperation between member states, and between member states and third countries, on guarantees of origin, on administrative procedures and on information and training.\",\n      \"dct:language\": \"en\"\n    },\n    {\n      \"@type\": \"poliana:Provision\",\n      \"poliana:text\": \"it also establishes sustainability and greenhouse gas emissions saving criteria for biofuels, bioliquids and biomass fuels.\",\n      \"dct:language\": \"en\"\n    }\n  ]\n}\njsonld",
    "success": false,
    "metadata": {
      "policy_info": {
        "Titel": "EU_32018L2001_Title_0_Chapter_0_Section_0_Article_01",
        "CELEX_Number": "32018L2001",
        "ELI": "http://data.europa.eu/eli/dir/2018/2001/oj",
        "Annotators": [
          "C",
          "F",
          "B"
        ]
      },
      "prompt_strategy": "zero-shot",
      "output_format": "json-ld",
      "model": "qwen2.5-coder:32b",
      "timestamp": "2025-04-21T19:43:19.857990"
    },
    "total_processing_time": 26.465489149093628,
    "triple_count": 0
  },
  "one-shot": {
    "is_valid": true,
    "error": null,
    "extracted_content": "{\n  \"@context\": {\n    \"eli\": \"http://data.europa.eu/eli/\",\n    \"xsd\": \"http://www.w3.org/2001/XMLSchema#\",\n    \"skos\": \"http://www.w3.org/2004/02/skos/core#\",\n    \"PoliannaInstrumentScheme\": \"http://example.org/PoliannaInstrumentScheme#\",\n    \"PoliannaMonitoringScheme\": \"http://example.org/PoliannaMonitoringScheme#\"\n  },\n  \"@type\": \"eli:Directive\",\n  \"eli:title\": \"EU_32018L2001_Title_0_Chapter_0_Section_0_Article_01\",\n  \"eli:number\": \"32018L2001\",\n  \"eli:has_part\": {\n    \"@type\": \"eli:Article\",\n    \"eli:title\": \"subject matter\",\n    \"eli:text\": \"this directive establishes a common framework for the promotion of energy from renewable sources. it sets a binding union target for the overall share of energy from renewable sources in the union's gross final consumption of energy in 2030. it also lays down rules on financial support for electricity from renewable sources, on self-consumption of such electricity, on the use of energy from renewable sources in the heating and cooling sector and in the transport sector, on regional cooperation between member states, and between member states and third countries, on guarantees of origin, on administrative procedures and on information and training. it also establishes sustainability and greenhouse gas emissions saving criteria for biofuels, bioliquids and biomass fuels.\",\n    \"contains_instrument\": [\n      {\n        \"@type\": \"skos:Concept\",\n        \"skos:prefLabel\": \"Financial Support\",\n        \"inScheme\": \"PoliannaInstrumentScheme\"\n      },\n      {\n        \"@type\": \"skos:Concept\",\n        \"skos:prefLabel\": \"Self-Consumption\",\n        \"inScheme\": \"PoliannaInstrumentScheme\"\n      },\n      {\n        \"@type\": \"skos:Concept\",\n        \"skos:prefLabel\": \"Regional Cooperation\",\n        \"inScheme\": \"PoliannaInstrumentScheme\"\n      },\n      {\n        \"@type\": \"skos:Concept\",\n        \"skos:prefLabel\": \"Guarantees of Origin\",\n        \"inScheme\": \"PoliannaInstrumentScheme\"\n      },\n      {\n        \"@type\": \"skos:Concept\",\n        \"skos:prefLabel\": \"Administrative Procedures\",\n        \"inScheme\": \"PoliannaInstrumentScheme\"\n      },\n      {\n        \"@type\": \"skos:Concept\",\n        \"skos:prefLabel\": \"Information and Training\",\n        \"inScheme\": \"PoliannaInstrumentScheme\"\n      }\n    ],\n    \"contains_objective\": [\n      {\n        \"@type\": \"skos:Concept\",\n        \"skos:prefLabel\": \"Promotion of Energy from Renewable Sources\",\n        \"inScheme\": \"PoliannaMonitoringScheme\"\n      },\n      {\n        \"@type\": \"skos:Concept\",\n        \"skos:prefLabel\": \"Binding Union Target for Renewable Energy Share\",\n        \"inScheme\": \"PoliannaMonitoringScheme\"\n      }\n    ]\n  }\n}",
    "original_output": "```jsonld\n{\n  \"@context\": {\n    \"eli\": \"http://data.europa.eu/eli/\",\n    \"xsd\": \"http://www.w3.org/2001/XMLSchema#\",\n    \"skos\": \"http://www.w3.org/2004/02/skos/core#\",\n    \"PoliannaInstrumentScheme\": \"http://example.org/PoliannaInstrumentScheme#\",\n    \"PoliannaMonitoringScheme\": \"http://example.org/PoliannaMonitoringScheme#\"\n  },\n  \"@type\": \"eli:Directive\",\n  \"eli:title\": \"EU_32018L2001_Title_0_Chapter_0_Section_0_Article_01\",\n  \"eli:number\": \"32018L2001\",\n  \"eli:has_part\": {\n    \"@type\": \"eli:Article\",\n    \"eli:title\": \"subject matter\",\n    \"eli:text\": \"this directive establishes a common framework for the promotion of energy from renewable sources. it sets a binding union target for the overall share of energy from renewable sources in the union's gross final consumption of energy in 2030. it also lays down rules on financial support for electricity from renewable sources, on self-consumption of such electricity, on the use of energy from renewable sources in the heating and cooling sector and in the transport sector, on regional cooperation between member states, and between member states and third countries, on guarantees of origin, on administrative procedures and on information and training. it also establishes sustainability and greenhouse gas emissions saving criteria for biofuels, bioliquids and biomass fuels.\",\n    \"contains_instrument\": [\n      {\n        \"@type\": \"skos:Concept\",\n        \"skos:prefLabel\": \"Financial Support\",\n        \"inScheme\": \"PoliannaInstrumentScheme\"\n      },\n      {\n        \"@type\": \"skos:Concept\",\n        \"skos:prefLabel\": \"Self-Consumption\",\n        \"inScheme\": \"PoliannaInstrumentScheme\"\n      },\n      {\n        \"@type\": \"skos:Concept\",\n        \"skos:prefLabel\": \"Regional Cooperation\",\n        \"inScheme\": \"PoliannaInstrumentScheme\"\n      },\n      {\n        \"@type\": \"skos:Concept\",\n        \"skos:prefLabel\": \"Guarantees of Origin\",\n        \"inScheme\": \"PoliannaInstrumentScheme\"\n      },\n      {\n        \"@type\": \"skos:Concept\",\n        \"skos:prefLabel\": \"Administrative Procedures\",\n        \"inScheme\": \"PoliannaInstrumentScheme\"\n      },\n      {\n        \"@type\": \"skos:Concept\",\n        \"skos:prefLabel\": \"Information and Training\",\n        \"inScheme\": \"PoliannaInstrumentScheme\"\n      }\n    ],\n    \"contains_objective\": [\n      {\n        \"@type\": \"skos:Concept\",\n        \"skos:prefLabel\": \"Promotion of Energy from Renewable Sources\",\n        \"inScheme\": \"PoliannaMonitoringScheme\"\n      },\n      {\n        \"@type\": \"skos:Concept\",\n        \"skos:prefLabel\": \"Binding Union Target for Renewable Energy Share\",\n        \"inScheme\": \"PoliannaMonitoringScheme\"\n      }\n    ]\n  }\n}\n```",
    "generation_time": 38.57295346260071,
    "output": "```jsonld\n{\n  \"@context\": {\n    \"eli\": \"http://data.europa.eu/eli/\",\n    \"xsd\": \"http://www.w3.org/2001/XMLSchema#\",\n    \"skos\": \"http://www.w3.org/2004/02/skos/core#\",\n    \"PoliannaInstrumentScheme\": \"http://example.org/PoliannaInstrumentScheme#\",\n    \"PoliannaMonitoringScheme\": \"http://example.org/PoliannaMonitoringScheme#\"\n  },\n  \"@type\": \"eli:Directive\",\n  \"eli:title\": \"EU_32018L2001_Title_0_Chapter_0_Section_0_Article_01\",\n  \"eli:number\": \"32018L2001\",\n  \"eli:has_part\": {\n    \"@type\": \"eli:Article\",\n    \"eli:title\": \"subject matter\",\n    \"eli:text\": \"this directive establishes a common framework for the promotion of energy from renewable sources. it sets a binding union target for the overall share of energy from renewable sources in the union's gross final consumption of energy in 2030. it also lays down rules on financial support for electricity from renewable sources, on self-consumption of such electricity, on the use of energy from renewable sources in the heating and cooling sector and in the transport sector, on regional cooperation between member states, and between member states and third countries, on guarantees of origin, on administrative procedures and on information and training. it also establishes sustainability and greenhouse gas emissions saving criteria for biofuels, bioliquids and biomass fuels.\",\n    \"contains_instrument\": [\n      {\n        \"@type\": \"skos:Concept\",\n        \"skos:prefLabel\": \"Financial Support\",\n        \"inScheme\": \"PoliannaInstrumentScheme\"\n      },\n      {\n        \"@type\": \"skos:Concept\",\n        \"skos:prefLabel\": \"Self-Consumption\",\n        \"inScheme\": \"PoliannaInstrumentScheme\"\n      },\n      {\n        \"@type\": \"skos:Concept\",\n        \"skos:prefLabel\": \"Regional Cooperation\",\n        \"inScheme\": \"PoliannaInstrumentScheme\"\n      },\n      {\n        \"@type\": \"skos:Concept\",\n        \"skos:prefLabel\": \"Guarantees of Origin\",\n        \"inScheme\": \"PoliannaInstrumentScheme\"\n      },\n      {\n        \"@type\": \"skos:Concept\",\n        \"skos:prefLabel\": \"Administrative Procedures\",\n        \"inScheme\": \"PoliannaInstrumentScheme\"\n      },\n      {\n        \"@type\": \"skos:Concept\",\n        \"skos:prefLabel\": \"Information and Training\",\n        \"inScheme\": \"PoliannaInstrumentScheme\"\n      }\n    ],\n    \"contains_objective\": [\n      {\n        \"@type\": \"skos:Concept\",\n        \"skos:prefLabel\": \"Promotion of Energy from Renewable Sources\",\n        \"inScheme\": \"PoliannaMonitoringScheme\"\n      },\n      {\n        \"@type\": \"skos:Concept\",\n        \"skos:prefLabel\": \"Binding Union Target for Renewable Energy Share\",\n        \"inScheme\": \"PoliannaMonitoringScheme\"\n      }\n    ]\n  }\n}\n```",
    "success": true,
    "metadata": {
      "policy_info": {
        "Titel": "EU_32018L2001_Title_0_Chapter_0_Section_0_Article_01",
        "CELEX_Number": "32018L2001",
        "ELI": "http://data.europa.eu/eli/dir/2018/2001/oj",
        "Annotators": [
          "C",
          "F",
          "B"
        ]
      },
      "prompt_strategy": "one-shot",
      "output_format": "json-ld",
      "model": "qwen2.5-coder:32b",
      "timestamp": "2025-04-21T19:43:58.436994"
    },
    "total_processing_time": 38.58009386062622,
    "triple_count": 7
  }
}