{
  "zero-shot": {
    "is_valid": false,
    "error": "Expecting value: line 1 column 1 (char 0)",
    "extracted_content": "jsonld\n{\n  \"@context\": {\n    \"poliana\": \"http://data.europa.eu/polianna/\",\n    \"dct\": \"http://purl.org/dc/terms/\",\n    \"eli\": \"http://data.europa.eu/eli/ontology#\",\n    \"xsd\": \"http://www.w3.org/2001/XMLSchema#\"\n  },\n  \"@type\": \"poliana:LegalActArticle\",\n  \"dct:title\": \"EU_32018R1999_Title_0_Chapter_6_Section_3_Article_37\",\n  \"eli:hasIdentifier\": {\n    \"@type\": \"eli:Identifier\",\n    \"eli:schemeName\": \"CELEX\",\n    \"eli:keyValue\": \"32018R1999\"\n  },\n  \"eli:isRealizedBy\": [\n    {\n      \"@type\": \"eli:Expression\",\n      \"dct:title\": \"EU_32018R1999_Title_0_Chapter_6_Section_3_Article_37\",\n      \"eli:hasIdentifier\": {\n        \"@type\": \"eli:Identifier\",\n        \"eli:schemeName\": \"ELI\",\n        \"eli:keyValue\": \"http://data.europa.eu/eli/reg/2018/1999/oj\"\n      },\n      \"poliana:hasAnnotator\": [\n        {\n          \"@type\": \"poliana:Person\",\n          \"dct:title\": \"A\"\n        },\n        {\n          \"@type\": \"poliana:Person\",\n          \"dct:title\": \"C\"\n        }\n      ],\n      \"poliana:hasParagraph\": [\n        {\n          \"@type\": \"poliana:LegalActParagraph\",\n          \"dct:title\": \"1\",\n          \"dct:description\": \"By 1 January 2021, Member States shall establish, operate and seek to continuously improve national inventory systems to estimate anthropogenic emissions by sources and removals by sinks of greenhouse gases listed in Part 2 of Annex V and to ensure the timeliness, transparency, accuracy, consistency, comparability and completeness of their greenhouse gas inventories.\"\n        },\n        {\n          \"@type\": \"poliana:LegalActParagraph\",\n          \"dct:title\": \"2\",\n          \"dct:description\": \"Member States shall ensure that their competent inventory authorities have access to the information specified in Annex XII to this Regulation, make use of reporting systems established pursuant to Article 20 of Regulation (EU) No 517/2014 to improve the estimate of fluorinated gases in the national greenhouse gas inventories and are able to undertake the annual consistency checks referred to in points (i) and (j) of Part 1 of Annex V to this Regulation.\"\n        },\n        {\n          \"@type\": \"poliana:LegalActParagraph\",\n          \"dct:title\": \"3\",\n          \"dct:description\": \"A Union inventory system to ensure the timeliness, transparency, accuracy, consistency, comparability and completeness of national inventories with regard to the Union greenhouse gas inventory is hereby established. The Commission shall manage, maintain and seek to continuously improve that system which shall include the setting of a quality assurance and quality control programme, setting quality objectives and drafting an inventory quality assurance and quality control plan, procedures for completing emission estimates to compile the Union inventory pursuant to paragraph 5 of this Article and the reviews referred to in Article 38.\"\n        },\n        {\n          \"@type\": \"poliana:LegalActParagraph\",\n          \"dct:title\": \"4\",\n          \"dct:description\": \"The Commission shall perform an initial check of the accuracy of the preliminary greenhouse gas inventory data to be submitted by Member States pursuant to Article 26(3). It shall send the results of that check to Member States within six weeks of the submission deadline. Member States shall respond to any relevant questions raised by the initial check by 15 March, together with the final inventory submission for the year x-2.\"\n        },\n        {\n          \"@type\": \"poliana:LegalActParagraph\",\n          \"dct:title\": \"5\",\n          \"dct:description\": \"Where a Member State does not submit the inventory data required to compile the Union inventory by 15 March, the Commission may prepare estimates to complete the data submitted by the Member State, in consultation and close cooperation with the Member State concerned. The Commission shall use, for that purpose, the guidelines applicable for preparing the national greenhouse gas inventories.\"\n        },\n        {\n          \"@type\": \"poliana:LegalActParagraph\",\n          \"dct:title\": \"6\",\n          \"dct:description\": \"The Commission, assisted by the Climate Change Committee referred to in point (a) of Article 44(1), shall adopt implementing acts in order to set out rules on the structure, format and submission process of the information relating to national inventory systems and requirements on the establishment, operation and functioning of national inventory systems. In proposing such implementing acts, the Commission shall take into account any relevant decisions adopted by the bodies of the UNFCCC or of the Paris Agreement. Those implementing acts shall be adopted in accordance with the examination procedure referred to in Article 44(6).\"\n        },\n        {\n          \"@type\": \"poliana:LegalActParagraph\",\n          \"dct:title\": \"7\",\n          \"dct:description\": \"The Commission shall adopt delegated acts in accordance with Article 43 in order to supplement this Regulation by setting out rules concerning the requirements on the establishment, operation and functioning of the Union inventory system. In proposing such delegated acts, the Commission shall take into account any relevant decisions adopted by the bodies of the UNFCCC or of the Paris Agreement.\"\n        }\n      ]\n    }\n  ]\n}",
    "original_output": "jsonld\n{\n  \"@context\": {\n    \"poliana\": \"http://data.europa.eu/polianna/\",\n    \"dct\": \"http://purl.org/dc/terms/\",\n    \"eli\": \"http://data.europa.eu/eli/ontology#\",\n    \"xsd\": \"http://www.w3.org/2001/XMLSchema#\"\n  },\n  \"@type\": \"poliana:LegalActArticle\",\n  \"dct:title\": \"EU_32018R1999_Title_0_Chapter_6_Section_3_Article_37\",\n  \"eli:hasIdentifier\": {\n    \"@type\": \"eli:Identifier\",\n    \"eli:schemeName\": \"CELEX\",\n    \"eli:keyValue\": \"32018R1999\"\n  },\n  \"eli:isRealizedBy\": [\n    {\n      \"@type\": \"eli:Expression\",\n      \"dct:title\": \"EU_32018R1999_Title_0_Chapter_6_Section_3_Article_37\",\n      \"eli:hasIdentifier\": {\n        \"@type\": \"eli:Identifier\",\n        \"eli:schemeName\": \"ELI\",\n        \"eli:keyValue\": \"http://data.europa.eu/eli/reg/2018/1999/oj\"\n      },\n      \"poliana:hasAnnotator\": [\n        {\n          \"@type\": \"poliana:Person\",\n          \"dct:title\": \"A\"\n        },\n        {\n          \"@type\": \"poliana:Person\",\n          \"dct:title\": \"C\"\n        }\n      ],\n      \"poliana:hasParagraph\": [\n        {\n          \"@type\": \"poliana:LegalActParagraph\",\n          \"dct:title\": \"1\",\n          \"dct:description\": \"By 1 January 2021, Member States shall establish, operate and seek to continuously improve national inventory systems to estimate anthropogenic emissions by sources and removals by sinks of greenhouse gases listed in Part 2 of Annex V and to ensure the timeliness, transparency, accuracy, consistency, comparability and completeness of their greenhouse gas inventories.\"\n        },\n        {\n          \"@type\": \"poliana:LegalActParagraph\",\n          \"dct:title\": \"2\",\n          \"dct:description\": \"Member States shall ensure that their competent inventory authorities have access to the information specified in Annex XII to this Regulation, make use of reporting systems established pursuant to Article 20 of Regulation (EU) No 517/2014 to improve the estimate of fluorinated gases in the national greenhouse gas inventories and are able to undertake the annual consistency checks referred to in points (i) and (j) of Part 1 of Annex V to this Regulation.\"\n        },\n        {\n          \"@type\": \"poliana:LegalActParagraph\",\n          \"dct:title\": \"3\",\n          \"dct:description\": \"A Union inventory system to ensure the timeliness, transparency, accuracy, consistency, comparability and completeness of national inventories with regard to the Union greenhouse gas inventory is hereby established. The Commission shall manage, maintain and seek to continuously improve that system which shall include the setting of a quality assurance and quality control programme, setting quality objectives and drafting an inventory quality assurance and quality control plan, procedures for completing emission estimates to compile the Union inventory pursuant to paragraph 5 of this Article and the reviews referred to in Article 38.\"\n        },\n        {\n          \"@type\": \"poliana:LegalActParagraph\",\n          \"dct:title\": \"4\",\n          \"dct:description\": \"The Commission shall perform an initial check of the accuracy of the preliminary greenhouse gas inventory data to be submitted by Member States pursuant to Article 26(3). It shall send the results of that check to Member States within six weeks of the submission deadline. Member States shall respond to any relevant questions raised by the initial check by 15 March, together with the final inventory submission for the year x-2.\"\n        },\n        {\n          \"@type\": \"poliana:LegalActParagraph\",\n          \"dct:title\": \"5\",\n          \"dct:description\": \"Where a Member State does not submit the inventory data required to compile the Union inventory by 15 March, the Commission may prepare estimates to complete the data submitted by the Member State, in consultation and close cooperation with the Member State concerned. The Commission shall use, for that purpose, the guidelines applicable for preparing the national greenhouse gas inventories.\"\n        },\n        {\n          \"@type\": \"poliana:LegalActParagraph\",\n          \"dct:title\": \"6\",\n          \"dct:description\": \"The Commission, assisted by the Climate Change Committee referred to in point (a) of Article 44(1), shall adopt implementing acts in order to set out rules on the structure, format and submission process of the information relating to national inventory systems and requirements on the establishment, operation and functioning of national inventory systems. In proposing such implementing acts, the Commission shall take into account any relevant decisions adopted by the bodies of the UNFCCC or of the Paris Agreement. Those implementing acts shall be adopted in accordance with the examination procedure referred to in Article 44(6).\"\n        },\n        {\n          \"@type\": \"poliana:LegalActParagraph\",\n          \"dct:title\": \"7\",\n          \"dct:description\": \"The Commission shall adopt delegated acts in accordance with Article 43 in order to supplement this Regulation by setting out rules concerning the requirements on the establishment, operation and functioning of the Union inventory system. In proposing such delegated acts, the Commission shall take into account any relevant decisions adopted by the bodies of the UNFCCC or of the Paris Agreement.\"\n        }\n      ]\n    }\n  ]\n}",
    "generation_time": 60.53476643562317,
    "output": "jsonld\n{\n  \"@context\": {\n    \"poliana\": \"http://data.europa.eu/polianna/\",\n    \"dct\": \"http://purl.org/dc/terms/\",\n    \"eli\": \"http://data.europa.eu/eli/ontology#\",\n    \"xsd\": \"http://www.w3.org/2001/XMLSchema#\"\n  },\n  \"@type\": \"poliana:LegalActArticle\",\n  \"dct:title\": \"EU_32018R1999_Title_0_Chapter_6_Section_3_Article_37\",\n  \"eli:hasIdentifier\": {\n    \"@type\": \"eli:Identifier\",\n    \"eli:schemeName\": \"CELEX\",\n    \"eli:keyValue\": \"32018R1999\"\n  },\n  \"eli:isRealizedBy\": [\n    {\n      \"@type\": \"eli:Expression\",\n      \"dct:title\": \"EU_32018R1999_Title_0_Chapter_6_Section_3_Article_37\",\n      \"eli:hasIdentifier\": {\n        \"@type\": \"eli:Identifier\",\n        \"eli:schemeName\": \"ELI\",\n        \"eli:keyValue\": \"http://data.europa.eu/eli/reg/2018/1999/oj\"\n      },\n      \"poliana:hasAnnotator\": [\n        {\n          \"@type\": \"poliana:Person\",\n          \"dct:title\": \"A\"\n        },\n        {\n          \"@type\": \"poliana:Person\",\n          \"dct:title\": \"C\"\n        }\n      ],\n      \"poliana:hasParagraph\": [\n        {\n          \"@type\": \"poliana:LegalActParagraph\",\n          \"dct:title\": \"1\",\n          \"dct:description\": \"By 1 January 2021, Member States shall establish, operate and seek to continuously improve national inventory systems to estimate anthropogenic emissions by sources and removals by sinks of greenhouse gases listed in Part 2 of Annex V and to ensure the timeliness, transparency, accuracy, consistency, comparability and completeness of their greenhouse gas inventories.\"\n        },\n        {\n          \"@type\": \"poliana:LegalActParagraph\",\n          \"dct:title\": \"2\",\n          \"dct:description\": \"Member States shall ensure that their competent inventory authorities have access to the information specified in Annex XII to this Regulation, make use of reporting systems established pursuant to Article 20 of Regulation (EU) No 517/2014 to improve the estimate of fluorinated gases in the national greenhouse gas inventories and are able to undertake the annual consistency checks referred to in points (i) and (j) of Part 1 of Annex V to this Regulation.\"\n        },\n        {\n          \"@type\": \"poliana:LegalActParagraph\",\n          \"dct:title\": \"3\",\n          \"dct:description\": \"A Union inventory system to ensure the timeliness, transparency, accuracy, consistency, comparability and completeness of national inventories with regard to the Union greenhouse gas inventory is hereby established. The Commission shall manage, maintain and seek to continuously improve that system which shall include the setting of a quality assurance and quality control programme, setting quality objectives and drafting an inventory quality assurance and quality control plan, procedures for completing emission estimates to compile the Union inventory pursuant to paragraph 5 of this Article and the reviews referred to in Article 38.\"\n        },\n        {\n          \"@type\": \"poliana:LegalActParagraph\",\n          \"dct:title\": \"4\",\n          \"dct:description\": \"The Commission shall perform an initial check of the accuracy of the preliminary greenhouse gas inventory data to be submitted by Member States pursuant to Article 26(3). It shall send the results of that check to Member States within six weeks of the submission deadline. Member States shall respond to any relevant questions raised by the initial check by 15 March, together with the final inventory submission for the year x-2.\"\n        },\n        {\n          \"@type\": \"poliana:LegalActParagraph\",\n          \"dct:title\": \"5\",\n          \"dct:description\": \"Where a Member State does not submit the inventory data required to compile the Union inventory by 15 March, the Commission may prepare estimates to complete the data submitted by the Member State, in consultation and close cooperation with the Member State concerned. The Commission shall use, for that purpose, the guidelines applicable for preparing the national greenhouse gas inventories.\"\n        },\n        {\n          \"@type\": \"poliana:LegalActParagraph\",\n          \"dct:title\": \"6\",\n          \"dct:description\": \"The Commission, assisted by the Climate Change Committee referred to in point (a) of Article 44(1), shall adopt implementing acts in order to set out rules on the structure, format and submission process of the information relating to national inventory systems and requirements on the establishment, operation and functioning of national inventory systems. In proposing such implementing acts, the Commission shall take into account any relevant decisions adopted by the bodies of the UNFCCC or of the Paris Agreement. Those implementing acts shall be adopted in accordance with the examination procedure referred to in Article 44(6).\"\n        },\n        {\n          \"@type\": \"poliana:LegalActParagraph\",\n          \"dct:title\": \"7\",\n          \"dct:description\": \"The Commission shall adopt delegated acts in accordance with Article 43 in order to supplement this Regulation by setting out rules concerning the requirements on the establishment, operation and functioning of the Union inventory system. In proposing such delegated acts, the Commission shall take into account any relevant decisions adopted by the bodies of the UNFCCC or of the Paris Agreement.\"\n        }\n      ]\n    }\n  ]\n}",
    "success": false,
    "metadata": {
      "policy_info": {
        "Titel": "EU_32018R1999_Title_0_Chapter_6_Section_3_Article_37",
        "CELEX_Number": "32018R1999",
        "ELI": "http://data.europa.eu/eli/reg/2018/1999/oj",
        "Annotators": [
          "A",
          "C"
        ]
      },
      "prompt_strategy": "zero-shot",
      "output_format": "json-ld",
      "model": "qwen2.5-coder:32b",
      "timestamp": "2025-04-21T20:27:32.708324"
    },
    "total_processing_time": 60.53651738166809,
    "triple_count": 0
  },
  "one-shot": {
    "is_valid": true,
    "error": null,
    "extracted_content": "{\n  \"@context\": {\n    \"eli\": \"http://data.europa.eu/eli/\",\n    \"celex\": \"http://publications.europa.eu/resource/authority/legal-base/\",\n    \"poliana\": \"http://example.org/poliana#\",\n    \"xsd\": \"http://www.w3.org/2001/XMLSchema#\"\n  },\n  \"@id\": \"http://data.europa.eu/eli/reg/2018/1999/oj/chapter_6/section_3/article_37\",\n  \"@type\": \"poliana:PolicyArticle\",\n  \"eli:title\": \"EU_32018R1999_Title_0_Chapter_6_Section_3_Article_37\",\n  \"celex:number\": \"32018R1999\",\n  \"eli:hasAnnotator\": [\n    {\"@id\": \"A\"},\n    {\"@id\": \"C\"}\n  ],\n  \"poliana:hasParagraph\": [\n    {\n      \"@type\": \"poliana:PolicyParagraph\",\n      \"poliana:paragraphNumber\": \"1\",\n      \"poliana:text\": \"by 1 january 2021, member states shall establish, operate and seek to continuously improve national inventory systems to estimate anthropogenic emissions by sources and removals by sinks of greenhouse gases listed in part 2 of annex v and to ensure the timeliness, transparency, accuracy, consistency, comparability and completeness of their greenhouse gas inventories.\",\n      \"poliana:hasDeadline\": {\n        \"@type\": \"xsd:date\",\n        \"@value\": \"2021-01-01\"\n      },\n      \"poliana:hasInstrument\": {\n        \"@id\": \"http://example.org/poliana#RegulatoryInstr\",\n        \"@type\": \"skos:Concept\",\n        \"skos:prefLabel\": \"Regulatory Instrument\"\n      }\n    },\n    {\n      \"@type\": \"poliana:PolicyParagraph\",\n      \"poliana:paragraphNumber\": \"2\",\n      \"poliana:text\": \"member states shall ensure that their competent inventory authorities have access to the information specified in annex xii to this regulation, make use of reporting systems established pursuant to article 20 of regulation (eu) no 517/2014 to improve the estimate of fluorinated gases in the national greenhouse gas inventories and are able to undertake the annual consistency checks referred to in points (i) and (j) of part 1 of annex v to this regulation.\"\n    },\n    {\n      \"@type\": \"poliana:PolicyParagraph\",\n      \"poliana:paragraphNumber\": \"3\",\n      \"poliana:text\": \"a union inventory system to ensure the timeliness, transparency, accuracy, consistency, comparability and completeness of national inventories with regard to the union greenhouse gas inventory is hereby established. the commission shall manage, maintain and seek to continuously improve that system which shall include the setting of a quality assurance and quality control programme, setting quality objectives and drafting an inventory quality assurance and quality control plan, procedures for completing emission estimates to compile the union inventory pursuant to paragraph 5 of this article and the reviews referred to in article 38.\"\n    },\n    {\n      \"@type\": \"poliana:PolicyParagraph\",\n      \"poliana:paragraphNumber\": \"4\",\n      \"poliana:text\": \"the commission shall perform an initial check of the accuracy of the preliminary greenhouse gas inventory data to be submitted by member states pursuant to article 26(3). it shall send the results of that check to member states within six weeks of the submission deadline. member states shall respond to any relevant questions raised by the initial check by 15 march, together with the final inventory submission for the year x-2.\"\n    },\n    {\n      \"@type\": \"poliana:PolicyParagraph\",\n      \"poliana:paragraphNumber\": \"5\",\n      \"poliana:text\": \"where a member state does not submit the inventory data required to compile the union inventory by 15 march, the commission may prepare estimates to complete the data submitted by the member state, in consultation and close cooperation with the member state concerned. the commission shall use, for that purpose, the guidelines applicable for preparing the national greenhouse gas inventories.\"\n    },\n    {\n      \"@type\": \"poliana:PolicyParagraph\",\n      \"poliana:paragraphNumber\": \"6\",\n      \"poliana:text\": \"the commission shall adopt implementing acts in accordance with the examination procedure referred to in article 290 of the treaty on the function of the union, laying down rules for the implementation of this regulation.\"\n    }\n  ]\n}",
    "original_output": "jsonld\n{\n  \"@context\": {\n    \"eli\": \"http://data.europa.eu/eli/\",\n    \"celex\": \"http://publications.europa.eu/resource/authority/legal-base/\",\n    \"poliana\": \"http://example.org/poliana#\",\n    \"xsd\": \"http://www.w3.org/2001/XMLSchema#\"\n  },\n  \"@id\": \"http://data.europa.eu/eli/reg/2018/1999/oj/chapter_6/section_3/article_37\",\n  \"@type\": \"poliana:PolicyArticle\",\n  \"eli:title\": \"EU_32018R1999_Title_0_Chapter_6_Section_3_Article_37\",\n  \"celex:number\": \"32018R1999\",\n  \"eli:hasAnnotator\": [\n    {\"@id\": \"A\"},\n    {\"@id\": \"C\"}\n  ],\n  \"poliana:hasParagraph\": [\n    {\n      \"@type\": \"poliana:PolicyParagraph\",\n      \"poliana:paragraphNumber\": \"1\",\n      \"poliana:text\": \"by 1 january 2021, member states shall establish, operate and seek to continuously improve national inventory systems to estimate anthropogenic emissions by sources and removals by sinks of greenhouse gases listed in part 2 of annex v and to ensure the timeliness, transparency, accuracy, consistency, comparability and completeness of their greenhouse gas inventories.\",\n      \"poliana:hasDeadline\": {\n        \"@type\": \"xsd:date\",\n        \"@value\": \"2021-01-01\"\n      },\n      \"poliana:hasInstrument\": {\n        \"@id\": \"http://example.org/poliana#RegulatoryInstr\",\n        \"@type\": \"skos:Concept\",\n        \"skos:prefLabel\": \"Regulatory Instrument\"\n      }\n    },\n    {\n      \"@type\": \"poliana:PolicyParagraph\",\n      \"poliana:paragraphNumber\": \"2\",\n      \"poliana:text\": \"member states shall ensure that their competent inventory authorities have access to the information specified in annex xii to this regulation, make use of reporting systems established pursuant to article 20 of regulation (eu) no 517/2014 to improve the estimate of fluorinated gases in the national greenhouse gas inventories and are able to undertake the annual consistency checks referred to in points (i) and (j) of part 1 of annex v to this regulation.\"\n    },\n    {\n      \"@type\": \"poliana:PolicyParagraph\",\n      \"poliana:paragraphNumber\": \"3\",\n      \"poliana:text\": \"a union inventory system to ensure the timeliness, transparency, accuracy, consistency, comparability and completeness of national inventories with regard to the union greenhouse gas inventory is hereby established. the commission shall manage, maintain and seek to continuously improve that system which shall include the setting of a quality assurance and quality control programme, setting quality objectives and drafting an inventory quality assurance and quality control plan, procedures for completing emission estimates to compile the union inventory pursuant to paragraph 5 of this article and the reviews referred to in article 38.\"\n    },\n    {\n      \"@type\": \"poliana:PolicyParagraph\",\n      \"poliana:paragraphNumber\": \"4\",\n      \"poliana:text\": \"the commission shall perform an initial check of the accuracy of the preliminary greenhouse gas inventory data to be submitted by member states pursuant to article 26(3). it shall send the results of that check to member states within six weeks of the submission deadline. member states shall respond to any relevant questions raised by the initial check by 15 march, together with the final inventory submission for the year x-2.\"\n    },\n    {\n      \"@type\": \"poliana:PolicyParagraph\",\n      \"poliana:paragraphNumber\": \"5\",\n      \"poliana:text\": \"where a member state does not submit the inventory data required to compile the union inventory by 15 march, the commission may prepare estimates to complete the data submitted by the member state, in consultation and close cooperation with the member state concerned. the commission shall use, for that purpose, the guidelines applicable for preparing the national greenhouse gas inventories.\"\n    },\n    {\n      \"@type\": \"poliana:PolicyParagraph\",\n      \"poliana:paragraphNumber\": \"6\",\n      \"poliana:text\": \"the commission, assisted by the climate change committee referred to in point (a) of article 44(1), shall adopt implementing acts in order to set out rules on the structure, format and submission process of the information relating to national inventory systems and requirements on the establishment, operation and functioning of national inventory systems. in proposing such implementing acts, the commission shall take into account any relevant decisions adopted by the bodies of the unfccc or of the paris agreement. those implementing acts shall be adopted in accordance with the examination procedure referred to in article 290 of the treaty on the function of the union.\"\n    },\n    {\n      \"@type\": \"poliana:PolicyParagraph\",\n      \"poliana:paragraphNumber\": \"7\",\n      \"poliana:text\": \"those implementing acts shall enter into force 20 days after their publication in the official journal of the european union. they shall be directly applicable and shall have immediate effect.\"\n    }\n  ]\n}\njsonld\n```jsonld\n{\n  \"@context\": {\n    \"eli\": \"http://data.europa.eu/eli/\",\n    \"celex\": \"http://publications.europa.eu/resource/authority/legal-base/\",\n    \"poliana\": \"http://example.org/poliana#\",\n    \"xsd\": \"http://www.w3.org/2001/XMLSchema#\"\n  },\n  \"@id\": \"http://data.europa.eu/eli/reg/2018/1999/oj/chapter_6/section_3/article_37\",\n  \"@type\": \"poliana:PolicyArticle\",\n  \"eli:title\": \"EU_32018R1999_Title_0_Chapter_6_Section_3_Article_37\",\n  \"celex:number\": \"32018R1999\",\n  \"eli:hasAnnotator\": [\n    {\"@id\": \"A\"},\n    {\"@id\": \"C\"}\n  ],\n  \"poliana:hasParagraph\": [\n    {\n      \"@type\": \"poliana:PolicyParagraph\",\n      \"poliana:paragraphNumber\": \"1\",\n      \"poliana:text\": \"by 1 january 2021, member states shall establish, operate and seek to continuously improve national inventory systems to estimate anthropogenic emissions by sources and removals by sinks of greenhouse gases listed in part 2 of annex v and to ensure the timeliness, transparency, accuracy, consistency, comparability and completeness of their greenhouse gas inventories.\",\n      \"poliana:hasDeadline\": {\n        \"@type\": \"xsd:date\",\n        \"@value\": \"2021-01-01\"\n      },\n      \"poliana:hasInstrument\": {\n        \"@id\": \"http://example.org/poliana#RegulatoryInstr\",\n        \"@type\": \"skos:Concept\",\n        \"skos:prefLabel\": \"Regulatory Instrument\"\n      }\n    },\n    {\n      \"@type\": \"poliana:PolicyParagraph\",\n      \"poliana:paragraphNumber\": \"2\",\n      \"poliana:text\": \"member states shall ensure that their competent inventory authorities have access to the information specified in annex xii to this regulation, make use of reporting systems established pursuant to article 20 of regulation (eu) no 517/2014 to improve the estimate of fluorinated gases in the national greenhouse gas inventories and are able to undertake the annual consistency checks referred to in points (i) and (j) of part 1 of annex v to this regulation.\"\n    },\n    {\n      \"@type\": \"poliana:PolicyParagraph\",\n      \"poliana:paragraphNumber\": \"3\",\n      \"poliana:text\": \"a union inventory system to ensure the timeliness, transparency, accuracy, consistency, comparability and completeness of national inventories with regard to the union greenhouse gas inventory is hereby established. the commission shall manage, maintain and seek to continuously improve that system which shall include the setting of a quality assurance and quality control programme, setting quality objectives and drafting an inventory quality assurance and quality control plan, procedures for completing emission estimates to compile the union inventory pursuant to paragraph 5 of this article and the reviews referred to in article 38.\"\n    },\n    {\n      \"@type\": \"poliana:PolicyParagraph\",\n      \"poliana:paragraphNumber\": \"4\",\n      \"poliana:text\": \"the commission shall perform an initial check of the accuracy of the preliminary greenhouse gas inventory data to be submitted by member states pursuant to article 26(3). it shall send the results of that check to member states within six weeks of the submission deadline. member states shall respond to any relevant questions raised by the initial check by 15 march, together with the final inventory submission for the year x-2.\"\n    },\n    {\n      \"@type\": \"poliana:PolicyParagraph\",\n      \"poliana:paragraphNumber\": \"5\",\n      \"poliana:text\": \"where a member state does not submit the inventory data required to compile the union inventory by 15 march, the commission may prepare estimates to complete the data submitted by the member state, in consultation and close cooperation with the member state concerned. the commission shall use, for that purpose, the guidelines applicable for preparing the national greenhouse gas inventories.\"\n    },\n    {\n      \"@type\": \"poliana:PolicyParagraph\",\n      \"poliana:paragraphNumber\": \"6\",\n      \"poliana:text\": \"the commission shall adopt implementing acts in accordance with the examination procedure referred to in article 290 of the treaty on the function of the union, laying down rules for the implementation of this regulation.\"\n    }\n  ]\n}\n```",
    "generation_time": 107.96578049659729,
    "output": "jsonld\n{\n  \"@context\": {\n    \"eli\": \"http://data.europa.eu/eli/\",\n    \"celex\": \"http://publications.europa.eu/resource/authority/legal-base/\",\n    \"poliana\": \"http://example.org/poliana#\",\n    \"xsd\": \"http://www.w3.org/2001/XMLSchema#\"\n  },\n  \"@id\": \"http://data.europa.eu/eli/reg/2018/1999/oj/chapter_6/section_3/article_37\",\n  \"@type\": \"poliana:PolicyArticle\",\n  \"eli:title\": \"EU_32018R1999_Title_0_Chapter_6_Section_3_Article_37\",\n  \"celex:number\": \"32018R1999\",\n  \"eli:hasAnnotator\": [\n    {\"@id\": \"A\"},\n    {\"@id\": \"C\"}\n  ],\n  \"poliana:hasParagraph\": [\n    {\n      \"@type\": \"poliana:PolicyParagraph\",\n      \"poliana:paragraphNumber\": \"1\",\n      \"poliana:text\": \"by 1 january 2021, member states shall establish, operate and seek to continuously improve national inventory systems to estimate anthropogenic emissions by sources and removals by sinks of greenhouse gases listed in part 2 of annex v and to ensure the timeliness, transparency, accuracy, consistency, comparability and completeness of their greenhouse gas inventories.\",\n      \"poliana:hasDeadline\": {\n        \"@type\": \"xsd:date\",\n        \"@value\": \"2021-01-01\"\n      },\n      \"poliana:hasInstrument\": {\n        \"@id\": \"http://example.org/poliana#RegulatoryInstr\",\n        \"@type\": \"skos:Concept\",\n        \"skos:prefLabel\": \"Regulatory Instrument\"\n      }\n    },\n    {\n      \"@type\": \"poliana:PolicyParagraph\",\n      \"poliana:paragraphNumber\": \"2\",\n      \"poliana:text\": \"member states shall ensure that their competent inventory authorities have access to the information specified in annex xii to this regulation, make use of reporting systems established pursuant to article 20 of regulation (eu) no 517/2014 to improve the estimate of fluorinated gases in the national greenhouse gas inventories and are able to undertake the annual consistency checks referred to in points (i) and (j) of part 1 of annex v to this regulation.\"\n    },\n    {\n      \"@type\": \"poliana:PolicyParagraph\",\n      \"poliana:paragraphNumber\": \"3\",\n      \"poliana:text\": \"a union inventory system to ensure the timeliness, transparency, accuracy, consistency, comparability and completeness of national inventories with regard to the union greenhouse gas inventory is hereby established. the commission shall manage, maintain and seek to continuously improve that system which shall include the setting of a quality assurance and quality control programme, setting quality objectives and drafting an inventory quality assurance and quality control plan, procedures for completing emission estimates to compile the union inventory pursuant to paragraph 5 of this article and the reviews referred to in article 38.\"\n    },\n    {\n      \"@type\": \"poliana:PolicyParagraph\",\n      \"poliana:paragraphNumber\": \"4\",\n      \"poliana:text\": \"the commission shall perform an initial check of the accuracy of the preliminary greenhouse gas inventory data to be submitted by member states pursuant to article 26(3). it shall send the results of that check to member states within six weeks of the submission deadline. member states shall respond to any relevant questions raised by the initial check by 15 march, together with the final inventory submission for the year x-2.\"\n    },\n    {\n      \"@type\": \"poliana:PolicyParagraph\",\n      \"poliana:paragraphNumber\": \"5\",\n      \"poliana:text\": \"where a member state does not submit the inventory data required to compile the union inventory by 15 march, the commission may prepare estimates to complete the data submitted by the member state, in consultation and close cooperation with the member state concerned. the commission shall use, for that purpose, the guidelines applicable for preparing the national greenhouse gas inventories.\"\n    },\n    {\n      \"@type\": \"poliana:PolicyParagraph\",\n      \"poliana:paragraphNumber\": \"6\",\n      \"poliana:text\": \"the commission, assisted by the climate change committee referred to in point (a) of article 44(1), shall adopt implementing acts in order to set out rules on the structure, format and submission process of the information relating to national inventory systems and requirements on the establishment, operation and functioning of national inventory systems. in proposing such implementing acts, the commission shall take into account any relevant decisions adopted by the bodies of the unfccc or of the paris agreement. those implementing acts shall be adopted in accordance with the examination procedure referred to in article 290 of the treaty on the function of the union.\"\n    },\n    {\n      \"@type\": \"poliana:PolicyParagraph\",\n      \"poliana:paragraphNumber\": \"7\",\n      \"poliana:text\": \"those implementing acts shall enter into force 20 days after their publication in the official journal of the european union. they shall be directly applicable and shall have immediate effect.\"\n    }\n  ]\n}\njsonld\n```jsonld\n{\n  \"@context\": {\n    \"eli\": \"http://data.europa.eu/eli/\",\n    \"celex\": \"http://publications.europa.eu/resource/authority/legal-base/\",\n    \"poliana\": \"http://example.org/poliana#\",\n    \"xsd\": \"http://www.w3.org/2001/XMLSchema#\"\n  },\n  \"@id\": \"http://data.europa.eu/eli/reg/2018/1999/oj/chapter_6/section_3/article_37\",\n  \"@type\": \"poliana:PolicyArticle\",\n  \"eli:title\": \"EU_32018R1999_Title_0_Chapter_6_Section_3_Article_37\",\n  \"celex:number\": \"32018R1999\",\n  \"eli:hasAnnotator\": [\n    {\"@id\": \"A\"},\n    {\"@id\": \"C\"}\n  ],\n  \"poliana:hasParagraph\": [\n    {\n      \"@type\": \"poliana:PolicyParagraph\",\n      \"poliana:paragraphNumber\": \"1\",\n      \"poliana:text\": \"by 1 january 2021, member states shall establish, operate and seek to continuously improve national inventory systems to estimate anthropogenic emissions by sources and removals by sinks of greenhouse gases listed in part 2 of annex v and to ensure the timeliness, transparency, accuracy, consistency, comparability and completeness of their greenhouse gas inventories.\",\n      \"poliana:hasDeadline\": {\n        \"@type\": \"xsd:date\",\n        \"@value\": \"2021-01-01\"\n      },\n      \"poliana:hasInstrument\": {\n        \"@id\": \"http://example.org/poliana#RegulatoryInstr\",\n        \"@type\": \"skos:Concept\",\n        \"skos:prefLabel\": \"Regulatory Instrument\"\n      }\n    },\n    {\n      \"@type\": \"poliana:PolicyParagraph\",\n      \"poliana:paragraphNumber\": \"2\",\n      \"poliana:text\": \"member states shall ensure that their competent inventory authorities have access to the information specified in annex xii to this regulation, make use of reporting systems established pursuant to article 20 of regulation (eu) no 517/2014 to improve the estimate of fluorinated gases in the national greenhouse gas inventories and are able to undertake the annual consistency checks referred to in points (i) and (j) of part 1 of annex v to this regulation.\"\n    },\n    {\n      \"@type\": \"poliana:PolicyParagraph\",\n      \"poliana:paragraphNumber\": \"3\",\n      \"poliana:text\": \"a union inventory system to ensure the timeliness, transparency, accuracy, consistency, comparability and completeness of national inventories with regard to the union greenhouse gas inventory is hereby established. the commission shall manage, maintain and seek to continuously improve that system which shall include the setting of a quality assurance and quality control programme, setting quality objectives and drafting an inventory quality assurance and quality control plan, procedures for completing emission estimates to compile the union inventory pursuant to paragraph 5 of this article and the reviews referred to in article 38.\"\n    },\n    {\n      \"@type\": \"poliana:PolicyParagraph\",\n      \"poliana:paragraphNumber\": \"4\",\n      \"poliana:text\": \"the commission shall perform an initial check of the accuracy of the preliminary greenhouse gas inventory data to be submitted by member states pursuant to article 26(3). it shall send the results of that check to member states within six weeks of the submission deadline. member states shall respond to any relevant questions raised by the initial check by 15 march, together with the final inventory submission for the year x-2.\"\n    },\n    {\n      \"@type\": \"poliana:PolicyParagraph\",\n      \"poliana:paragraphNumber\": \"5\",\n      \"poliana:text\": \"where a member state does not submit the inventory data required to compile the union inventory by 15 march, the commission may prepare estimates to complete the data submitted by the member state, in consultation and close cooperation with the member state concerned. the commission shall use, for that purpose, the guidelines applicable for preparing the national greenhouse gas inventories.\"\n    },\n    {\n      \"@type\": \"poliana:PolicyParagraph\",\n      \"poliana:paragraphNumber\": \"6\",\n      \"poliana:text\": \"the commission shall adopt implementing acts in accordance with the examination procedure referred to in article 290 of the treaty on the function of the union, laying down rules for the implementation of this regulation.\"\n    }\n  ]\n}\n```",
    "success": true,
    "metadata": {
      "policy_info": {
        "Titel": "EU_32018R1999_Title_0_Chapter_6_Section_3_Article_37",
        "CELEX_Number": "32018R1999",
        "ELI": "http://data.europa.eu/eli/reg/2018/1999/oj",
        "Annotators": [
          "A",
          "C"
        ]
      },
      "prompt_strategy": "one-shot",
      "output_format": "json-ld",
      "model": "qwen2.5-coder:32b",
      "timestamp": "2025-04-21T20:29:20.681551"
    },
    "total_processing_time": 107.97845268249512,
    "triple_count": 33
  }
}