{
  "zero-shot": {
    "is_valid": false,
    "error": "Expecting value: line 1 column 1 (char 0)",
    "extracted_content": "jsonld\n{\n  \"@context\": {\n    \"poliana\": \"http://data.europa.eu/polianna/\",\n    \"dct\": \"http://purl.org/dc/terms/\",\n    \"celex\": \"http://publications.europa.eu/resource/authority/legal-base-type/\"\n  },\n  \"@type\": \"poliana:LegalAct\",\n  \"dct:title\": \"EU_32018L2001_Title_0_Chapter_0_Section_0_Article_16\",\n  \"celex:number\": \"32018L2001\",\n  \"dct:identifier\": {\n    \"@type\": \"poliana:ELI\",\n    \"@id\": \"http://data.europa.eu/eli/dir/2018/2001/oj\"\n  },\n  \"poliana:annotators\": [\n    {\n      \"@type\": \"poliana:Annotator\",\n      \"dct:title\": \"C\"\n    },\n    {\n      \"@type\": \"poliana:Annotator\",\n      \"dct:title\": \"F\"\n    }\n  ],\n  \"poliana:hasArticle\": {\n    \"@type\": \"poliana:Article\",\n    \"dct:title\": \"article 16\",\n    \"dct:description\": \"organisation and duration of the permit-granting process\",\n    \"poliana:paragraphs\": [\n      {\n        \"@type\": \"poliana:Paragraph\",\n        \"dct:title\": \"1\",\n        \"dct:description\": \"member states shall set up or designate one or more contact points. those contact points shall, upon request by the applicant, guide through and facilitate the entire administrative permit application and granting process. the applicant shall not be required to contact more than one contact point for the entire process. the permit-granting process shall cover the relevant administrative permits to build, repower and operate plants for the production of energy from renewable sources and assets necessary for their connection to the grid. the permit-granting process shall comprise all procedures from the acknowledgment of the receipt of the application to the transmission of the outcome of the procedure referred to in paragraph 2.\"\n      },\n      {\n        \"@type\": \"poliana:Paragraph\",\n        \"dct:title\": \"2\",\n        \"dct:description\": \"the contact point shall guide the applicant through the administrative permit application process in a transparent manner up to the delivery of one or several decisions by the responsible authorities at the end of the process, provide the applicant with all necessary information and involve, where appropriate, other administrative authorities. applicants shall be allowed to submit relevant documents also in digital form.\"\n      },\n      {\n        \"@type\": \"poliana:Paragraph\",\n        \"dct:title\": \"3\",\n        \"dct:description\": \"the contact point shall make available a manual of procedures for developers of renewable energy production projects and shall provide that information also online, addressing distinctly also small-scale projects and renewables self-consumers projects. the online information shall indicate the contact point relevant to the applicant's application. if a member state has more than one contact point, the online information shall indicate the contact point relevant to the applicant's application.\"\n      },\n      {\n        \"@type\": \"poliana:Paragraph\",\n        \"dct:title\": \"4\",\n        \"dct:description\": \"without prejudice to paragraph 7, the permit-granting process referred to in paragraph 1 shall not exceed two years for power plants, including all relevant procedures of competent authorities. where duly justified on the grounds of extraordinary circumstances, that two-year period may be extended by up to one year.\"\n      },\n      {\n        \"@type\": \"poliana:Paragraph\",\n        \"dct:title\": \"5\",\n        \"dct:description\": \"without prejudice to paragraph 7, the permit-granting process shall not exceed one year for installations with an electrical capacity of less than 150 kw. where duly justified on the grounds of extraordinary circumstances, that one-year period may be extended by up to one year.\"\n      },\n      {\n        \"@type\": \"poliana:Paragraph\",\n        \"dct:title\": \"6\",\n        \"dct:description\": \"member states shall ensure that applicants have easy access to simple procedures for the settlement of disputes concerning the permit-granting process and the issuance of permits to build and operate renewable energy plants, including, where applicable, alternative dispute resolution mechanisms.\"\n      },\n      {\n        \"@type\": \"poliana:Paragraph\",\n        \"dct:title\": \"7\",\n        \"dct:description\": \"member states shall facilitate the repowering of existing renewable energy plants by ensuring a simplified and swift permit-granting process. the length of that process shall not exceed one year. where duly justified on the grounds of extraordinary circumstances, such as on grounds of overriding safety reasons where the repowering project impacts substantially on the grid or the original capacity, size or performance of the installation, that one-year period may be extended by up to one year.\"\n      },\n      {\n        \"@type\": \"poliana:Paragraph\",\n        \"dct:title\": \"8\",\n        \"dct:description\": \"without prejudice to paragraph 7, the permit-granting process referred to in paragraph 1 shall not exceed two years for power plants, including all relevant procedures of competent authorities. where duly justified on the grounds of extraordinary circumstances, that two-year period may be extended by up to one year.\"\n      },\n      {\n        \"@type\": \"poliana:Paragraph\",\n        \"dct:title\": \"9\",\n        \"dct:description\": \"without prejudice to paragraph 7, the permit-granting process shall not exceed one year for installations with an electrical capacity of less than 150 kw. where duly justified on the grounds of extraordinary circumstances, that one-year period may be extended by up to one year.\"\n      }\n    ]\n  }\n}",
    "original_output": "jsonld\n{\n  \"@context\": {\n    \"poliana\": \"http://data.europa.eu/polianna/\",\n    \"dct\": \"http://purl.org/dc/terms/\",\n    \"celex\": \"http://publications.europa.eu/resource/authority/legal-base-type/\"\n  },\n  \"@type\": \"poliana:LegalAct\",\n  \"dct:title\": \"EU_32018L2001_Title_0_Chapter_0_Section_0_Article_16\",\n  \"celex:number\": \"32018L2001\",\n  \"dct:identifier\": {\n    \"@type\": \"poliana:ELI\",\n    \"@id\": \"http://data.europa.eu/eli/dir/2018/2001/oj\"\n  },\n  \"poliana:annotators\": [\n    {\n      \"@type\": \"poliana:Annotator\",\n      \"dct:title\": \"C\"\n    },\n    {\n      \"@type\": \"poliana:Annotator\",\n      \"dct:title\": \"F\"\n    }\n  ],\n  \"poliana:hasArticle\": {\n    \"@type\": \"poliana:Article\",\n    \"dct:title\": \"article 16\",\n    \"dct:description\": \"organisation and duration of the permit-granting process\",\n    \"poliana:paragraphs\": [\n      {\n        \"@type\": \"poliana:Paragraph\",\n        \"dct:title\": \"1\",\n        \"dct:description\": \"member states shall set up or designate one or more contact points. those contact points shall, upon request by the applicant, guide through and facilitate the entire administrative permit application and granting process. the applicant shall not be required to contact more than one contact point for the entire process. the permit-granting process shall cover the relevant administrative permits to build, repower and operate plants for the production of energy from renewable sources and assets necessary for their connection to the grid. the permit-granting process shall comprise all procedures from the acknowledgment of the receipt of the application to the transmission of the outcome of the procedure referred to in paragraph 2.\"\n      },\n      {\n        \"@type\": \"poliana:Paragraph\",\n        \"dct:title\": \"2\",\n        \"dct:description\": \"the contact point shall guide the applicant through the administrative permit application process in a transparent manner up to the delivery of one or several decisions by the responsible authorities at the end of the process, provide the applicant with all necessary information and involve, where appropriate, other administrative authorities. applicants shall be allowed to submit relevant documents also in digital form.\"\n      },\n      {\n        \"@type\": \"poliana:Paragraph\",\n        \"dct:title\": \"3\",\n        \"dct:description\": \"the contact point shall make available a manual of procedures for developers of renewable energy production projects and shall provide that information also online, addressing distinctly also small-scale projects and renewables self-consumers projects. the online information shall indicate the contact point relevant to the applicant's application. if a member state has more than one contact point, the online information shall indicate the contact point relevant to the applicant's application.\"\n      },\n      {\n        \"@type\": \"poliana:Paragraph\",\n        \"dct:title\": \"4\",\n        \"dct:description\": \"without prejudice to paragraph 7, the permit-granting process referred to in paragraph 1 shall not exceed two years for power plants, including all relevant procedures of competent authorities. where duly justified on the grounds of extraordinary circumstances, that two-year period may be extended by up to one year.\"\n      },\n      {\n        \"@type\": \"poliana:Paragraph\",\n        \"dct:title\": \"5\",\n        \"dct:description\": \"without prejudice to paragraph 7, the permit-granting process shall not exceed one year for installations with an electrical capacity of less than 150 kw. where duly justified on the grounds of extraordinary circumstances, that one-year period may be extended by up to one year.\"\n      },\n      {\n        \"@type\": \"poliana:Paragraph\",\n        \"dct:title\": \"6\",\n        \"dct:description\": \"member states shall ensure that applicants have easy access to simple procedures for the settlement of disputes concerning the permit-granting process and the issuance of permits to build and operate renewable energy plants, including, where applicable, alternative dispute resolution mechanisms.\"\n      },\n      {\n        \"@type\": \"poliana:Paragraph\",\n        \"dct:title\": \"7\",\n        \"dct:description\": \"member states shall facilitate the repowering of existing renewable energy plants by ensuring a simplified and swift permit-granting process. the length of that process shall not exceed one year. where duly justified on the grounds of extraordinary circumstances, such as on grounds of overriding safety reasons where the repowering project impacts substantially on the grid or the original capacity, size or performance of the installation, that one-year period may be extended by up to one year.\"\n      },\n      {\n        \"@type\": \"poliana:Paragraph\",\n        \"dct:title\": \"8\",\n        \"dct:description\": \"without prejudice to paragraph 7, the permit-granting process referred to in paragraph 1 shall not exceed two years for power plants, including all relevant procedures of competent authorities. where duly justified on the grounds of extraordinary circumstances, that two-year period may be extended by up to one year.\"\n      },\n      {\n        \"@type\": \"poliana:Paragraph\",\n        \"dct:title\": \"9\",\n        \"dct:description\": \"without prejudice to paragraph 7, the permit-granting process shall not exceed one year for installations with an electrical capacity of less than 150 kw. where duly justified on the grounds of extraordinary circumstances, that one-year period may be extended by up to one year.\"\n      }\n    ]\n  }\n}",
    "generation_time": 61.666203022003174,
    "output": "jsonld\n{\n  \"@context\": {\n    \"poliana\": \"http://data.europa.eu/polianna/\",\n    \"dct\": \"http://purl.org/dc/terms/\",\n    \"celex\": \"http://publications.europa.eu/resource/authority/legal-base-type/\"\n  },\n  \"@type\": \"poliana:LegalAct\",\n  \"dct:title\": \"EU_32018L2001_Title_0_Chapter_0_Section_0_Article_16\",\n  \"celex:number\": \"32018L2001\",\n  \"dct:identifier\": {\n    \"@type\": \"poliana:ELI\",\n    \"@id\": \"http://data.europa.eu/eli/dir/2018/2001/oj\"\n  },\n  \"poliana:annotators\": [\n    {\n      \"@type\": \"poliana:Annotator\",\n      \"dct:title\": \"C\"\n    },\n    {\n      \"@type\": \"poliana:Annotator\",\n      \"dct:title\": \"F\"\n    }\n  ],\n  \"poliana:hasArticle\": {\n    \"@type\": \"poliana:Article\",\n    \"dct:title\": \"article 16\",\n    \"dct:description\": \"organisation and duration of the permit-granting process\",\n    \"poliana:paragraphs\": [\n      {\n        \"@type\": \"poliana:Paragraph\",\n        \"dct:title\": \"1\",\n        \"dct:description\": \"member states shall set up or designate one or more contact points. those contact points shall, upon request by the applicant, guide through and facilitate the entire administrative permit application and granting process. the applicant shall not be required to contact more than one contact point for the entire process. the permit-granting process shall cover the relevant administrative permits to build, repower and operate plants for the production of energy from renewable sources and assets necessary for their connection to the grid. the permit-granting process shall comprise all procedures from the acknowledgment of the receipt of the application to the transmission of the outcome of the procedure referred to in paragraph 2.\"\n      },\n      {\n        \"@type\": \"poliana:Paragraph\",\n        \"dct:title\": \"2\",\n        \"dct:description\": \"the contact point shall guide the applicant through the administrative permit application process in a transparent manner up to the delivery of one or several decisions by the responsible authorities at the end of the process, provide the applicant with all necessary information and involve, where appropriate, other administrative authorities. applicants shall be allowed to submit relevant documents also in digital form.\"\n      },\n      {\n        \"@type\": \"poliana:Paragraph\",\n        \"dct:title\": \"3\",\n        \"dct:description\": \"the contact point shall make available a manual of procedures for developers of renewable energy production projects and shall provide that information also online, addressing distinctly also small-scale projects and renewables self-consumers projects. the online information shall indicate the contact point relevant to the applicant's application. if a member state has more than one contact point, the online information shall indicate the contact point relevant to the applicant's application.\"\n      },\n      {\n        \"@type\": \"poliana:Paragraph\",\n        \"dct:title\": \"4\",\n        \"dct:description\": \"without prejudice to paragraph 7, the permit-granting process referred to in paragraph 1 shall not exceed two years for power plants, including all relevant procedures of competent authorities. where duly justified on the grounds of extraordinary circumstances, that two-year period may be extended by up to one year.\"\n      },\n      {\n        \"@type\": \"poliana:Paragraph\",\n        \"dct:title\": \"5\",\n        \"dct:description\": \"without prejudice to paragraph 7, the permit-granting process shall not exceed one year for installations with an electrical capacity of less than 150 kw. where duly justified on the grounds of extraordinary circumstances, that one-year period may be extended by up to one year.\"\n      },\n      {\n        \"@type\": \"poliana:Paragraph\",\n        \"dct:title\": \"6\",\n        \"dct:description\": \"member states shall ensure that applicants have easy access to simple procedures for the settlement of disputes concerning the permit-granting process and the issuance of permits to build and operate renewable energy plants, including, where applicable, alternative dispute resolution mechanisms.\"\n      },\n      {\n        \"@type\": \"poliana:Paragraph\",\n        \"dct:title\": \"7\",\n        \"dct:description\": \"member states shall facilitate the repowering of existing renewable energy plants by ensuring a simplified and swift permit-granting process. the length of that process shall not exceed one year. where duly justified on the grounds of extraordinary circumstances, such as on grounds of overriding safety reasons where the repowering project impacts substantially on the grid or the original capacity, size or performance of the installation, that one-year period may be extended by up to one year.\"\n      },\n      {\n        \"@type\": \"poliana:Paragraph\",\n        \"dct:title\": \"8\",\n        \"dct:description\": \"without prejudice to paragraph 7, the permit-granting process referred to in paragraph 1 shall not exceed two years for power plants, including all relevant procedures of competent authorities. where duly justified on the grounds of extraordinary circumstances, that two-year period may be extended by up to one year.\"\n      },\n      {\n        \"@type\": \"poliana:Paragraph\",\n        \"dct:title\": \"9\",\n        \"dct:description\": \"without prejudice to paragraph 7, the permit-granting process shall not exceed one year for installations with an electrical capacity of less than 150 kw. where duly justified on the grounds of extraordinary circumstances, that one-year period may be extended by up to one year.\"\n      }\n    ]\n  }\n}",
    "success": false,
    "metadata": {
      "policy_info": {
        "Titel": "EU_32018L2001_Title_0_Chapter_0_Section_0_Article_16",
        "CELEX_Number": "32018L2001",
        "ELI": "http://data.europa.eu/eli/dir/2018/2001/oj",
        "Annotators": [
          "C",
          "F"
        ]
      },
      "prompt_strategy": "zero-shot",
      "output_format": "json-ld",
      "model": "qwen2.5-coder:32b",
      "timestamp": "2025-04-21T18:53:07.013517"
    },
    "total_processing_time": 61.669981718063354,
    "triple_count": 0
  },
  "one-shot": {
    "is_valid": true,
    "error": null,
    "extracted_content": "{\n  \"@context\": {\n    \"dct\": \"http://purl.org/dc/terms/\",\n    \"eli\": \"http://data.europa.eu/eli/ontology#\",\n    \"poliana\": \"https://w3id.org/poliana/ontology#\"\n  },\n  \"@type\": \"eli:Article\",\n  \"dct:title\": \"organisation and duration of the permit-granting process\",\n  \"eli:number\": \"16\",\n  \"eli:hasExpression\": {\n    \"@type\": \"eli:LegalResource\",\n    \"eli:expressionDate\": \"2018-12-31\",\n    \"eli:isVersionOf\": {\n      \"@id\": \"http://data.europa.eu/eli/dir/2018/2001/oj\"\n    },\n    \"poliana:hasParagraph\": [\n      {\n        \"@type\": \"poliana:Paragraph\",\n        \"dct:description\": \"Member states shall set up or designate one or more contact points. Those contact points shall, upon request by the applicant, guide through and facilitate the entire administrative permit application and granting process. The applicant shall not be required to contact more than one contact point for the entire process. The permit-granting process shall cover the relevant administrative permits to build, repower and operate plants for the production of energy from renewable sources and assets necessary for their connection to the grid.\",\n        \"eli:number\": \"1\"\n      },\n      {\n        \"@type\": \"poliana:Paragraph\",\n        \"dct:description\": \"The contact points must provide transparent guidance, all necessary information, and involve other authorities as appropriate. Applicants can submit documents in digital form.\",\n        \"eli:number\": \"2\"\n      },\n      {\n        \"@type\": \"poliana:Paragraph\",\n        \"dct:description\": \"Contact points must make available a manual of procedures for developers of renewable energy projects, including small-scale and self-consumption projects. Online information should clearly indicate the relevant contact point.\",\n        \"eli:number\": \"3\"\n      },\n      {\n        \"@type\": \"poliana:Paragraph\",\n        \"dct:description\": \"The permit-granting process for power plants must not exceed two years, with a possible one-year extension in extraordinary circumstances.\",\n        \"eli:number\": \"4\"\n      },\n      {\n        \"@type\": \"poliana:Paragraph\",\n        \"dct:description\": \"For installations with an electrical capacity of less than 150 kW, the permit-granting process must not exceed one year, with a possible one-year extension in extraordinary circumstances.\",\n        \"eli:number\": \"5\"\n      },\n      {\n        \"@type\": \"poliana:Paragraph\",\n        \"dct:description\": \"Member states must provide easy access to simple procedures for dispute resolution concerning the permit-granting process and issuance of permits, including alternative dispute resolution mechanisms where applicable.\",\n        \"eli:number\": \"6\"\n      }\n    ]\n  },\n  \"poliana:hasAnnotation\": [\n    {\n      \"@type\": \"poliana:Annotation\",\n      \"dct:description\": \"This article establishes the requirements for member states to set up or designate contact points to guide applicants through the administrative permit application and granting process for renewable energy plants.\",\n      \"poliana:annotatesParagraph\": \"1\"\n    },\n    {\n      \"@type\": \"poliana:Annotation\",\n      \"dct:description\": \"The contact point must provide transparent guidance, necessary information, and involve other authorities as appropriate. Applicants can submit documents in digital form.\",\n      \"poliana:annotatesParagraph\": \"2\"\n    },\n    {\n      \"@type\": \"poliana:Annotation\",\n      \"dct:description\": \"Contact points must make available a manual of procedures for developers of renewable energy projects, including small-scale and self-consumption projects. Online information should clearly indicate the relevant contact point.\",\n      \"poliana:annotatesParagraph\": \"3\"\n    },\n    {\n      \"@type\": \"poliana:Annotation\",\n      \"dct:description\": \"The permit-granting process for power plants must not exceed two years, with a possible one-year extension in extraordinary circumstances.\",\n      \"poliana:annotatesParagraph\": \"4\"\n    },\n    {\n      \"@type\": \"poliana:Annotation\",\n      \"dct:description\": \"For installations with an electrical capacity of less than 150 kW, the permit-granting process must not exceed one year, with a possible one-year extension in extraordinary circumstances.\",\n      \"poliana:annotatesParagraph\": \"5\"\n    },\n    {\n      \"@type\": \"poliana:Annotation\",\n      \"dct:description\": \"Member states must provide easy access to simple procedures for dispute resolution concerning the permit-granting process and issuance of permits, including alternative dispute resolution mechanisms where applicable.\",\n      \"poliana:annotatesParagraph\": \"6\"\n    }\n  ]\n}",
    "original_output": "jsonld\n{\n  \"@context\": {\n    \"dct\": \"http://purl.org/dc/terms/\",\n    \"eli\": \"http://data.europa.eu/eli/ontology#\",\n    \"poliana\": \"https://w3id.org/poliana/ontology#\"\n  },\n  \"@type\": \"eli:Article\",\n  \"dct:title\": \"organisation and duration of the permit-granting process\",\n  \"eli:number\": \"16\",\n  \"eli:hasExpression\": {\n    \"@type\": \"eli:LegalResource\",\n    \"eli:expressionDate\": \"2018-12-31\",\n    \"eli:isVersionOf\": {\n      \"@id\": \"http://data.europa.eu/eli/dir/2018/2001/oj\"\n    },\n    \"poliana:hasParagraph\": [\n      {\n        \"@type\": \"poliana:Paragraph\",\n        \"dct:description\": \"Member states shall set up or designate one or more contact points. Those contact points shall, upon request by the applicant, guide through and facilitate the entire administrative permit application and granting process. The applicant shall not be required to contact more than one contact point for the entire process. The permit-granting process shall cover the relevant administrative permits to build, repower and operate plants for the production of energy from renewable sources and assets necessary for their connection to the grid. The permit-granting process shall comprise all procedures from the acknowledgment of the receipt of the application to the transmission of the outcome of the procedure referred to in paragraph 2.\",\n        \"eli:number\": \"1\"\n      },\n      {\n        \"@type\": \"poliana:Paragraph\",\n        \"dct:description\": \"The contact point shall guide the applicant through the administrative permit application process in a transparent manner up to the delivery of one or several decisions by the responsible authorities at the end of the process, provide the applicant with all necessary information and involve, where appropriate, other administrative authorities. Applicants shall be allowed to submit relevant documents also in digital form.\",\n        \"eli:number\": \"2\"\n      },\n      {\n        \"@type\": \"poliana:Paragraph\",\n        \"dct:description\": \"The contact point shall make available a manual of procedures for developers of renewable energy production projects and shall provide that information also online, addressing distinctly also small-scale projects and renewables self-consumers projects. The online information shall indicate the contact point relevant to the applicant's application. If a member state has more than one contact point, the online information shall indicate the contact point relevant to the applicant's application.\",\n        \"eli:number\": \"3\"\n      },\n      {\n        \"@type\": \"poliana:Paragraph\",\n        \"dct:description\": \"Without prejudice to paragraph 7, the permit-granting process referred to in paragraph 1 shall not exceed two years for power plants, including all relevant procedures of competent authorities. Where duly justified on the grounds of extraordinary circumstances, that two-year period may be extended by up to one year.\",\n        \"eli:number\": \"4\"\n      },\n      {\n        \"@type\": \"poliana:Paragraph\",\n        \"dct:description\": \"Without prejudice to paragraph 7, the permit-granting process shall not exceed one year for installations with an electrical capacity of less than 150 kw. Where duly justified on the grounds of extraordinary circumstances, that one-year period may be extended by up to one year.\",\n        \"eli:number\": \"5\"\n      },\n      {\n        \"@type\": \"poliana:Paragraph\",\n        \"dct:description\": \"Member states shall ensure that applicants have easy access to simple procedures for the settlement of disputes concerning the permit-granting process and the issuance of permits to build and operate renewable energy plants, including, where applicable, alternative dispute resolution mechanisms.\",\n        \"eli:number\": \"5\"\n      },\n      {\n        \"@type\": \"poliana:Paragraph\",\n        \"dct:description\": \"Member states shall facilitate the repowering of existing renewable energy plants by ensuring a simplified and swift permit-granting process. The length of that process shall not exceed one year. Where duly justified on the grounds of extraordinary circumstances, such as on grounds of overriding safety reasons where the repowering project impacts substantially on the grid or the original capacity, size or performance of the installation, that one-year period may be extended by up to one year.\",\n        \"eli:number\": \"6\"\n      },\n      {\n        \"@type\": \"poliana:Paragraph\",\n        \"dct:description\": \"The deadlines established in this article shall apply without prejudice to obligations under applicable union environmental law, to judicial appeals, remedies and other proceedings before a court or tribunal, and to alternative dispute resolution mechanisms, including complaints procedures, non-judicial appeals and remedies, and may be extended for the duration of such procedures.\",\n        \"eli:number\": \"7\"\n      },\n      {\n        \"@type\": \"poliana:Paragraph\",\n        \"dct:description\": \"Member states may establish a simple permit-granting process for repowering existing renewable energy plants. The length of that process shall not exceed one year, and it may be extended by up to one year in extraordinary circumstances.\",\n        \"eli:number\": \"6\"\n      },\n      {\n        \"@type\": \"poliana:Paragraph\",\n        \"dct:description\": \"Member states may establish a simple permit-granting process for repowering existing renewable energy plants. The length of that process shall not exceed one year, and it may be extended by up to one year in extraordinary circumstances.\",\n        \"eli:number\": \"7\"\n      },\n      {\n        \"@type\": \"poliana:Paragraph\",\n        \"dct:description\": \"Member states may establish a simple permit-granting process for repowering existing renewable energy plants. The length of that process shall not exceed one year, and it may be extended by up to one year in extraordinary circumstances.\",\n        \"eli:number\": \"8\"\n      }\n    ]\n  },\n  \"poliana:hasAnnotation\": [\n    {\n      \"@type\": \"poliana:Annotation\",\n      \"dct:description\": \"This article establishes the requirements for member states to set up or designate contact points to guide applicants through the administrative permit application and granting process for renewable energy plants.\",\n      \"poliana:annotatesParagraph\": \"1\"\n    },\n    {\n      \"@type\": \"poliana:Annotation\",\n      \"dct:description\": \"The contact point must provide transparent guidance, necessary information, and involve other authorities as appropriate. Applicants can submit documents in digital form.\",\n      \"poliana:annotatesParagraph\": \"2\"\n    },\n    {\n      \"@type\": \"poliana:Annotation\",\n      \"dct:description\": \"Contact points must make available a manual of procedures for developers of renewable energy projects, including small-scale and self-consumption projects. Online information should clearly indicate the relevant contact point.\",\n      \"poliana:annotatesParagraph\": \"3\"\n    },\n    {\n      \"@type\": \"poliana:Annotation\",\n      \"dct:description\": \"The permit-granting process for power plants must not exceed two years, with a possible one-year extension in extraordinary circumstances.\",\n      \"poliana:annotatesParagraph\": \"4\"\n    },\n    {\n      \"@type\": \"poliana:Annotation\",\n      \"dct:description\": \"For installations with an electrical capacity of less than 150 kW, the permit-granting process must not exceed one year, with a possible one-year extension in extraordinary circumstances.\",\n      \"poliana:annotatesParagraph\": \"5\"\n    },\n    {\n      \"@type\": \"poliana:Annotation\",\n      \"dct:description\": \"Member states must provide easy access to simple procedures for dispute resolution concerning the permit-granting process and issuance of permits, including alternative dispute resolution mechanisms where applicable.\",\n      \"poliana:annotatesParagraph\": \"5\"\n    },\n    {\n      \"@type\": \"poliana:Annotation\",\n      \"dct:description\": \"Member states must facilitate the repowering of existing renewable energy plants with a simplified and swift permit-granting process that does not exceed one year, with a possible one-year extension in extraordinary circumstances.\",\n      \"poliana:annotatesParagraph\": \"6\"\n    },\n    {\n      \"@type\": \"poliana:Annotation\",\n      \"dct:description\": \"The deadlines established in this article do not affect obligations under applicable union environmental law or other legal proceedings. They may be extended for the duration of such procedures.\",\n      \"poliana:annotatesParagraph\": \"7\"\n    }\n  ]\n}jsonld\n```jsonld\n{\n  \"@context\": {\n    \"dct\": \"http://purl.org/dc/terms/\",\n    \"eli\": \"http://data.europa.eu/eli/ontology#\",\n    \"poliana\": \"https://w3id.org/poliana/ontology#\"\n  },\n  \"@type\": \"eli:Article\",\n  \"dct:title\": \"organisation and duration of the permit-granting process\",\n  \"eli:number\": \"16\",\n  \"eli:hasExpression\": {\n    \"@type\": \"eli:LegalResource\",\n    \"eli:expressionDate\": \"2018-12-31\",\n    \"eli:isVersionOf\": {\n      \"@id\": \"http://data.europa.eu/eli/dir/2018/2001/oj\"\n    },\n    \"poliana:hasParagraph\": [\n      {\n        \"@type\": \"poliana:Paragraph\",\n        \"dct:description\": \"Member states shall set up or designate one or more contact points. Those contact points shall, upon request by the applicant, guide through and facilitate the entire administrative permit application and granting process. The applicant shall not be required to contact more than one contact point for the entire process. The permit-granting process shall cover the relevant administrative permits to build, repower and operate plants for the production of energy from renewable sources and assets necessary for their connection to the grid.\",\n        \"eli:number\": \"1\"\n      },\n      {\n        \"@type\": \"poliana:Paragraph\",\n        \"dct:description\": \"The contact points must provide transparent guidance, all necessary information, and involve other authorities as appropriate. Applicants can submit documents in digital form.\",\n        \"eli:number\": \"2\"\n      },\n      {\n        \"@type\": \"poliana:Paragraph\",\n        \"dct:description\": \"Contact points must make available a manual of procedures for developers of renewable energy projects, including small-scale and self-consumption projects. Online information should clearly indicate the relevant contact point.\",\n        \"eli:number\": \"3\"\n      },\n      {\n        \"@type\": \"poliana:Paragraph\",\n        \"dct:description\": \"The permit-granting process for power plants must not exceed two years, with a possible one-year extension in extraordinary circumstances.\",\n        \"eli:number\": \"4\"\n      },\n      {\n        \"@type\": \"poliana:Paragraph\",\n        \"dct:description\": \"For installations with an electrical capacity of less than 150 kW, the permit-granting process must not exceed one year, with a possible one-year extension in extraordinary circumstances.\",\n        \"eli:number\": \"5\"\n      },\n      {\n        \"@type\": \"poliana:Paragraph\",\n        \"dct:description\": \"Member states must provide easy access to simple procedures for dispute resolution concerning the permit-granting process and issuance of permits, including alternative dispute resolution mechanisms where applicable.\",\n        \"eli:number\": \"6\"\n      }\n    ]\n  },\n  \"poliana:hasAnnotation\": [\n    {\n      \"@type\": \"poliana:Annotation\",\n      \"dct:description\": \"This article establishes the requirements for member states to set up or designate contact points to guide applicants through the administrative permit application and granting process for renewable energy plants.\",\n      \"poliana:annotatesParagraph\": \"1\"\n    },\n    {\n      \"@type\": \"poliana:Annotation\",\n      \"dct:description\": \"The contact point must provide transparent guidance, necessary information, and involve other authorities as appropriate. Applicants can submit documents in digital form.\",\n      \"poliana:annotatesParagraph\": \"2\"\n    },\n    {\n      \"@type\": \"poliana:Annotation\",\n      \"dct:description\": \"Contact points must make available a manual of procedures for developers of renewable energy projects, including small-scale and self-consumption projects. Online information should clearly indicate the relevant contact point.\",\n      \"poliana:annotatesParagraph\": \"3\"\n    },\n    {\n      \"@type\": \"poliana:Annotation\",\n      \"dct:description\": \"The permit-granting process for power plants must not exceed two years, with a possible one-year extension in extraordinary circumstances.\",\n      \"poliana:annotatesParagraph\": \"4\"\n    },\n    {\n      \"@type\": \"poliana:Annotation\",\n      \"dct:description\": \"For installations with an electrical capacity of less than 150 kW, the permit-granting process must not exceed one year, with a possible one-year extension in extraordinary circumstances.\",\n      \"poliana:annotatesParagraph\": \"5\"\n    },\n    {\n      \"@type\": \"poliana:Annotation\",\n      \"dct:description\": \"Member states must provide easy access to simple procedures for dispute resolution concerning the permit-granting process and issuance of permits, including alternative dispute resolution mechanisms where applicable.\",\n      \"poliana:annotatesParagraph\": \"6\"\n    }\n  ]\n}\n```",
    "generation_time": 142.28627038002014,
    "output": "jsonld\n{\n  \"@context\": {\n    \"dct\": \"http://purl.org/dc/terms/\",\n    \"eli\": \"http://data.europa.eu/eli/ontology#\",\n    \"poliana\": \"https://w3id.org/poliana/ontology#\"\n  },\n  \"@type\": \"eli:Article\",\n  \"dct:title\": \"organisation and duration of the permit-granting process\",\n  \"eli:number\": \"16\",\n  \"eli:hasExpression\": {\n    \"@type\": \"eli:LegalResource\",\n    \"eli:expressionDate\": \"2018-12-31\",\n    \"eli:isVersionOf\": {\n      \"@id\": \"http://data.europa.eu/eli/dir/2018/2001/oj\"\n    },\n    \"poliana:hasParagraph\": [\n      {\n        \"@type\": \"poliana:Paragraph\",\n        \"dct:description\": \"Member states shall set up or designate one or more contact points. Those contact points shall, upon request by the applicant, guide through and facilitate the entire administrative permit application and granting process. The applicant shall not be required to contact more than one contact point for the entire process. The permit-granting process shall cover the relevant administrative permits to build, repower and operate plants for the production of energy from renewable sources and assets necessary for their connection to the grid. The permit-granting process shall comprise all procedures from the acknowledgment of the receipt of the application to the transmission of the outcome of the procedure referred to in paragraph 2.\",\n        \"eli:number\": \"1\"\n      },\n      {\n        \"@type\": \"poliana:Paragraph\",\n        \"dct:description\": \"The contact point shall guide the applicant through the administrative permit application process in a transparent manner up to the delivery of one or several decisions by the responsible authorities at the end of the process, provide the applicant with all necessary information and involve, where appropriate, other administrative authorities. Applicants shall be allowed to submit relevant documents also in digital form.\",\n        \"eli:number\": \"2\"\n      },\n      {\n        \"@type\": \"poliana:Paragraph\",\n        \"dct:description\": \"The contact point shall make available a manual of procedures for developers of renewable energy production projects and shall provide that information also online, addressing distinctly also small-scale projects and renewables self-consumers projects. The online information shall indicate the contact point relevant to the applicant's application. If a member state has more than one contact point, the online information shall indicate the contact point relevant to the applicant's application.\",\n        \"eli:number\": \"3\"\n      },\n      {\n        \"@type\": \"poliana:Paragraph\",\n        \"dct:description\": \"Without prejudice to paragraph 7, the permit-granting process referred to in paragraph 1 shall not exceed two years for power plants, including all relevant procedures of competent authorities. Where duly justified on the grounds of extraordinary circumstances, that two-year period may be extended by up to one year.\",\n        \"eli:number\": \"4\"\n      },\n      {\n        \"@type\": \"poliana:Paragraph\",\n        \"dct:description\": \"Without prejudice to paragraph 7, the permit-granting process shall not exceed one year for installations with an electrical capacity of less than 150 kw. Where duly justified on the grounds of extraordinary circumstances, that one-year period may be extended by up to one year.\",\n        \"eli:number\": \"5\"\n      },\n      {\n        \"@type\": \"poliana:Paragraph\",\n        \"dct:description\": \"Member states shall ensure that applicants have easy access to simple procedures for the settlement of disputes concerning the permit-granting process and the issuance of permits to build and operate renewable energy plants, including, where applicable, alternative dispute resolution mechanisms.\",\n        \"eli:number\": \"5\"\n      },\n      {\n        \"@type\": \"poliana:Paragraph\",\n        \"dct:description\": \"Member states shall facilitate the repowering of existing renewable energy plants by ensuring a simplified and swift permit-granting process. The length of that process shall not exceed one year. Where duly justified on the grounds of extraordinary circumstances, such as on grounds of overriding safety reasons where the repowering project impacts substantially on the grid or the original capacity, size or performance of the installation, that one-year period may be extended by up to one year.\",\n        \"eli:number\": \"6\"\n      },\n      {\n        \"@type\": \"poliana:Paragraph\",\n        \"dct:description\": \"The deadlines established in this article shall apply without prejudice to obligations under applicable union environmental law, to judicial appeals, remedies and other proceedings before a court or tribunal, and to alternative dispute resolution mechanisms, including complaints procedures, non-judicial appeals and remedies, and may be extended for the duration of such procedures.\",\n        \"eli:number\": \"7\"\n      },\n      {\n        \"@type\": \"poliana:Paragraph\",\n        \"dct:description\": \"Member states may establish a simple permit-granting process for repowering existing renewable energy plants. The length of that process shall not exceed one year, and it may be extended by up to one year in extraordinary circumstances.\",\n        \"eli:number\": \"6\"\n      },\n      {\n        \"@type\": \"poliana:Paragraph\",\n        \"dct:description\": \"Member states may establish a simple permit-granting process for repowering existing renewable energy plants. The length of that process shall not exceed one year, and it may be extended by up to one year in extraordinary circumstances.\",\n        \"eli:number\": \"7\"\n      },\n      {\n        \"@type\": \"poliana:Paragraph\",\n        \"dct:description\": \"Member states may establish a simple permit-granting process for repowering existing renewable energy plants. The length of that process shall not exceed one year, and it may be extended by up to one year in extraordinary circumstances.\",\n        \"eli:number\": \"8\"\n      }\n    ]\n  },\n  \"poliana:hasAnnotation\": [\n    {\n      \"@type\": \"poliana:Annotation\",\n      \"dct:description\": \"This article establishes the requirements for member states to set up or designate contact points to guide applicants through the administrative permit application and granting process for renewable energy plants.\",\n      \"poliana:annotatesParagraph\": \"1\"\n    },\n    {\n      \"@type\": \"poliana:Annotation\",\n      \"dct:description\": \"The contact point must provide transparent guidance, necessary information, and involve other authorities as appropriate. Applicants can submit documents in digital form.\",\n      \"poliana:annotatesParagraph\": \"2\"\n    },\n    {\n      \"@type\": \"poliana:Annotation\",\n      \"dct:description\": \"Contact points must make available a manual of procedures for developers of renewable energy projects, including small-scale and self-consumption projects. Online information should clearly indicate the relevant contact point.\",\n      \"poliana:annotatesParagraph\": \"3\"\n    },\n    {\n      \"@type\": \"poliana:Annotation\",\n      \"dct:description\": \"The permit-granting process for power plants must not exceed two years, with a possible one-year extension in extraordinary circumstances.\",\n      \"poliana:annotatesParagraph\": \"4\"\n    },\n    {\n      \"@type\": \"poliana:Annotation\",\n      \"dct:description\": \"For installations with an electrical capacity of less than 150 kW, the permit-granting process must not exceed one year, with a possible one-year extension in extraordinary circumstances.\",\n      \"poliana:annotatesParagraph\": \"5\"\n    },\n    {\n      \"@type\": \"poliana:Annotation\",\n      \"dct:description\": \"Member states must provide easy access to simple procedures for dispute resolution concerning the permit-granting process and issuance of permits, including alternative dispute resolution mechanisms where applicable.\",\n      \"poliana:annotatesParagraph\": \"5\"\n    },\n    {\n      \"@type\": \"poliana:Annotation\",\n      \"dct:description\": \"Member states must facilitate the repowering of existing renewable energy plants with a simplified and swift permit-granting process that does not exceed one year, with a possible one-year extension in extraordinary circumstances.\",\n      \"poliana:annotatesParagraph\": \"6\"\n    },\n    {\n      \"@type\": \"poliana:Annotation\",\n      \"dct:description\": \"The deadlines established in this article do not affect obligations under applicable union environmental law or other legal proceedings. They may be extended for the duration of such procedures.\",\n      \"poliana:annotatesParagraph\": \"7\"\n    }\n  ]\n}jsonld\n```jsonld\n{\n  \"@context\": {\n    \"dct\": \"http://purl.org/dc/terms/\",\n    \"eli\": \"http://data.europa.eu/eli/ontology#\",\n    \"poliana\": \"https://w3id.org/poliana/ontology#\"\n  },\n  \"@type\": \"eli:Article\",\n  \"dct:title\": \"organisation and duration of the permit-granting process\",\n  \"eli:number\": \"16\",\n  \"eli:hasExpression\": {\n    \"@type\": \"eli:LegalResource\",\n    \"eli:expressionDate\": \"2018-12-31\",\n    \"eli:isVersionOf\": {\n      \"@id\": \"http://data.europa.eu/eli/dir/2018/2001/oj\"\n    },\n    \"poliana:hasParagraph\": [\n      {\n        \"@type\": \"poliana:Paragraph\",\n        \"dct:description\": \"Member states shall set up or designate one or more contact points. Those contact points shall, upon request by the applicant, guide through and facilitate the entire administrative permit application and granting process. The applicant shall not be required to contact more than one contact point for the entire process. The permit-granting process shall cover the relevant administrative permits to build, repower and operate plants for the production of energy from renewable sources and assets necessary for their connection to the grid.\",\n        \"eli:number\": \"1\"\n      },\n      {\n        \"@type\": \"poliana:Paragraph\",\n        \"dct:description\": \"The contact points must provide transparent guidance, all necessary information, and involve other authorities as appropriate. Applicants can submit documents in digital form.\",\n        \"eli:number\": \"2\"\n      },\n      {\n        \"@type\": \"poliana:Paragraph\",\n        \"dct:description\": \"Contact points must make available a manual of procedures for developers of renewable energy projects, including small-scale and self-consumption projects. Online information should clearly indicate the relevant contact point.\",\n        \"eli:number\": \"3\"\n      },\n      {\n        \"@type\": \"poliana:Paragraph\",\n        \"dct:description\": \"The permit-granting process for power plants must not exceed two years, with a possible one-year extension in extraordinary circumstances.\",\n        \"eli:number\": \"4\"\n      },\n      {\n        \"@type\": \"poliana:Paragraph\",\n        \"dct:description\": \"For installations with an electrical capacity of less than 150 kW, the permit-granting process must not exceed one year, with a possible one-year extension in extraordinary circumstances.\",\n        \"eli:number\": \"5\"\n      },\n      {\n        \"@type\": \"poliana:Paragraph\",\n        \"dct:description\": \"Member states must provide easy access to simple procedures for dispute resolution concerning the permit-granting process and issuance of permits, including alternative dispute resolution mechanisms where applicable.\",\n        \"eli:number\": \"6\"\n      }\n    ]\n  },\n  \"poliana:hasAnnotation\": [\n    {\n      \"@type\": \"poliana:Annotation\",\n      \"dct:description\": \"This article establishes the requirements for member states to set up or designate contact points to guide applicants through the administrative permit application and granting process for renewable energy plants.\",\n      \"poliana:annotatesParagraph\": \"1\"\n    },\n    {\n      \"@type\": \"poliana:Annotation\",\n      \"dct:description\": \"The contact point must provide transparent guidance, necessary information, and involve other authorities as appropriate. Applicants can submit documents in digital form.\",\n      \"poliana:annotatesParagraph\": \"2\"\n    },\n    {\n      \"@type\": \"poliana:Annotation\",\n      \"dct:description\": \"Contact points must make available a manual of procedures for developers of renewable energy projects, including small-scale and self-consumption projects. Online information should clearly indicate the relevant contact point.\",\n      \"poliana:annotatesParagraph\": \"3\"\n    },\n    {\n      \"@type\": \"poliana:Annotation\",\n      \"dct:description\": \"The permit-granting process for power plants must not exceed two years, with a possible one-year extension in extraordinary circumstances.\",\n      \"poliana:annotatesParagraph\": \"4\"\n    },\n    {\n      \"@type\": \"poliana:Annotation\",\n      \"dct:description\": \"For installations with an electrical capacity of less than 150 kW, the permit-granting process must not exceed one year, with a possible one-year extension in extraordinary circumstances.\",\n      \"poliana:annotatesParagraph\": \"5\"\n    },\n    {\n      \"@type\": \"poliana:Annotation\",\n      \"dct:description\": \"Member states must provide easy access to simple procedures for dispute resolution concerning the permit-granting process and issuance of permits, including alternative dispute resolution mechanisms where applicable.\",\n      \"poliana:annotatesParagraph\": \"6\"\n    }\n  ]\n}\n```",
    "success": true,
    "metadata": {
      "policy_info": {
        "Titel": "EU_32018L2001_Title_0_Chapter_0_Section_0_Article_16",
        "CELEX_Number": "32018L2001",
        "ELI": "http://data.europa.eu/eli/dir/2018/2001/oj",
        "Annotators": [
          "C",
          "F"
        ]
      },
      "prompt_strategy": "one-shot",
      "output_format": "json-ld",
      "model": "qwen2.5-coder:32b",
      "timestamp": "2025-04-21T18:55:29.310596"
    },
    "total_processing_time": 142.30525922775269,
    "triple_count": 55
  }
}