{
  "is_valid": true,
  "error": null,
  "extracted_content": "{\n  \"directive_title\": \"Energy Efficiency Directive\",\n  \"objective\": \"To improve energy efficiency in buildings and reduce greenhouse gas emissions.\",\n  \"scope\": \"Applies to all new buildings and existing buildings undergoing major renovations within the European Union.\",\n  \"requirements\": [\n    {\n      \"section\": \"Building Design and Construction\",\n      \"details\": [\n        \"All new buildings must meet minimum energy performance standards (MEPS).\",\n        \"Buildings undergoing major renovations must also comply with MEPS for the renovated parts.\"\n      ]\n    },\n    {\n      \"section\": \"Energy Performance Certificates\",\n      \"details\": [\n        \"Energy performance certificates (EPCs) must be issued for all buildings.\",\n        \"EPCs must include information on energy consumption, efficiency measures, and potential savings.\"\n      ]\n    },\n    {\n      \"section\": \"Renovation Obligations\",\n      \"details\": [\n        \"Buildings with an EPC rating below a certain threshold must undergo renovations to improve their energy performance.\",\n        \"The specific requirements for these renovations are outlined in the directive.\"\n      ]\n    },\n    {\n      \"section\": \"Monitoring and Reporting\",\n      \"details\": [\n        \"Member States must monitor and report on progress towards meeting energy efficiency targets.\",\n        \"Annual reports must be submitted to the European Commission detailing actions taken and results achieved.\"\n      ]\n    }\n  ],\n  \"compliance_and_enforcement\": {\n    \"monitoring\": \"The European Commission will regularly monitor compliance with the directive.\",\n    \"enforcement\": \"Enforcement action may include fines or other penalties for non-compliance.\",\n    \"appeals\": \"Member States have the right to appeal any enforcement decisions.\"\n  }\n}",
  "original_output": "jsonld\n{\n  \"@context\": {\n    \"poliana\": \"http://example.org/poliana#\",\n    \"schema\": \"http://schema.org/\",\n    \"rdfs\": \"http://www.w3.org/2000/01/rdf-schema#\"\n  },\n  \"@type\": \"poliana:Article\",\n  \"schema:name\": \"Energy Efficiency Obligation Schemes and Alternative Policy Measures\",\n  \"schema:description\": \"This article outlines the requirements for Member States to implement energy efficiency obligation schemes or alternative policy measures to achieve specific levels of energy savings by 2020.\",\n  \"poliana:hasSection\": [\n    {\n      \"@type\": \"poliana:Section\",\n      \"schema:name\": \"Obligation Schemes\",\n      \"schema:description\": \"Member States must implement obligation schemes that lead to the achievement of at least 1.5% annual energy savings in the period from 2014 to 2020.\",\n      \"poliana:hasSubSection\": [\n        {\n          \"@type\": \"poliana:SubSection\",\n          \"schema:name\": \"Exclusions and Adjustments\",\n          \"schema:description\": \"Obligation schemes do not apply to energy savings achieved through the application of mandatory EU law or through individual actions by final consumers.\",\n          \"poliana:hasRequirement\": [\n            {\n              \"@type\": \"poliana:Requirement\",\n              \"schema:name\": \"Exclusion of Mandatory EU Law Savings\",\n              \"schema:description\": \"Energy savings achieved through the application of mandatory EU law are excluded from the obligation schemes.\"\n            },\n            {\n              \"@type\": \"poliana:Requirement\",\n              \"schema:name\": \"Exclusion of Individual Actions by Final Consumers\",\n              \"schema:description\": \"Energy savings achieved through individual actions by final consumers are excluded from the obligation schemes.\"\n            }\n          ]\n        },\n        {\n          \"@type\": \"poliana:SubSection\",\n          \"schema:name\": \"Adjustments for Energy Savings Achieved Through Individual Actions\",\n          \"schema:description\": \"Member States may adjust the energy savings target downwards to account for energy savings achieved through individual actions by final consumers.\",\n          \"poliana:hasRequirement\": [\n            {\n              \"@type\": \"poliana:Requirement\",\n              \"schema:name\": \"Adjustment Mechanism\",\n              \"schema:description\": \"The adjustment mechanism must be transparent and verifiable.\"\n            }\n          ]\n        },\n        {\n          \"@type\": \"poliana:SubSection\",\n          \"schema:name\": \"Exclusions for Energy Savings Achieved Through Mandatory EU Law\",\n          \"schema:description\": \"Energy savings achieved through the application of mandatory EU law are excluded from the obligation schemes.\",\n          \"poliana:hasRequirement\": [\n            {\n              \"@type\": \"poliana:Requirement\",\n              \"schema:name\": \"Exclusion Mechanism\",\n              \"schema:description\": \"The exclusion mechanism must be transparent and verifiable.\"\n            }\n          ]\n        },\n        {\n          \"@type\": \"poliana:SubSection\",\n          \"schema:name\": \"Energy Savings Target Adjustments\",\n          \"schema:description\": \"Member States may adjust the energy savings target downwards to account for energy savings achieved through individual actions by final consumers.\",\n          \"poliana:hasRequirement\": [\n            {\n              \"@type\": \"poliana:Requirement\",\n              \"schema:name\": \"Adjustment Mechanism\",\n              \"schema:description\": \"The adjustment mechanism must be transparent and verifiable.\"\n            }\n          ]\n        },\n        {\n          \"@type\": \"poliana:SubSection\",\n          \"schema:name\": \"Energy Savings Calculation Methods\",\n          \"schema:description\": \"Member States must use the methods and principles provided in points (1) and (2) of Annex V to calculate energy savings.\",\n          \"poliana:hasRequirement\": [\n            {\n              \"@type\": \"poliana:Requirement\",\n              \"schema:name\": \"Calculation Method\",\n              \"schema:description\": \"Energy savings must be calculated using the methods and principles provided in points (1) and (2) of Annex V.\"\n            }\n          ]\n        },\n        {\n          \"@type\": \"poliana:SubSection\",\n          \"schema:name\": \"Verification of Energy Savings\",\n          \"schema:description\": \"Member States must put in place a control system that includes independent verification of a statistically significant proportion of the energy efficiency improvement measures.\",\n          \"poliana:hasRequirement\": [\n            {\n              \"@type\": \"poliana:Requirement\",\n              \"schema:name\": \"Control System\",\n              \"schema:description\": \"A control system must be put in place that includes independent verification of a statistically significant proportion of the energy efficiency improvement measures.\"\n            }\n          ]\n        },\n        {\n          \"@type\": \"poliana:SubSection\",\n          \"schema:name\": \"Publication of Energy Savings Data\",\n          \"schema:description\": \"Member States must publish data on the annual trend of energy savings annually.\",\n          \"poliana:hasRequirement\": [\n            {\n              \"@type\": \"poliana:Requirement\",\n              \"schema:name\": \"Data Publication\",\n              \"schema:description\": \"Data on the annual trend of energy savings must be published annually.\"\n            }\n          ]\n        },\n        {\n          \"@type\": \"poliana:SubSection\",\n          \"schema:name\": \"Exclusions and Adjustments for Energy Savings Achieved Through Individual Actions\",\n          \"schema:description\": \"Member States may adjust the energy savings target downwards to account for energy savings achieved through individual actions by final consumers.\",\n          \"poliana:hasRequirement\": [\n            {\n              \"@type\": \"poliana:Requirement\",\n              \"schema:name\": \"Adjustment Mechanism\",\n              \"schema:description\": \"The adjustment mechanism must be transparent and verifiable.\"\n            }\n          ]\n        },\n        {\n          \"@type\": \"poliana:SubSection\",\n          \"schema:name\": \"Exclusions for Energy Savings Achieved Through Mandatory EU Law\",\n          \"schema:description\": \"Energy savings achieved through the application of mandatory EU law are excluded from the obligation schemes.\",\n          \"poliana:hasRequirement\": [\n            {\n              \"@type\": \"poliana:Requirement\",\n              \"schema:name\": \"Exclusion Mechanism\",\n              \"schema:description\": \"The exclusion mechanism must be transparent and verifiable.\"\n            }\n          ]\n        },\n        {\n          \"@type\": \"poliana:SubSection\",\n          \"schema:name\": \"Energy Savings Target Adjustments\",\n          \"schema:description\": \"Member States may adjust the energy savings target downwards to account for energy savings achieved through individual actions by final consumers.\",\n          \"poliana:hasRequirement\": [\n            {\n              \"@type\": \"poliana:Requirement\",\n              \"schema:name\": \"Adjustment Mechanism\",\n              \"schema:description\": \"The adjustment mechanism must be transparent and verifiable.\"\n            }\n          ]\n        },\n        {\n          \"@type\": \"poliana:SubSection\",\n          \"schema:name\": \"Energy Savings Calculation Methods\",\n          \"schema:description\": \"Member States must use the methods and principles provided in points (1) and (2) of Annex V to calculate energy savings.\",\n          \"poliana:hasRequirement\": [\n            {\n              \"@type\": \"poliana:Requirement\",\n              \"schema:name\": \"Calculation Method\",\n              \"schema:description\": \"Energy savings must be calculated using the methods and principles provided in points (1) and (2) of Annex V.\"\n            }\n          ]\n        },\n        {\n          \"@type\": \"poliana:SubSection\",\n          \"schema:name\": \"Verification of Energy Savings\",\n          \"schema:description\": \"Member States must put in place a control system that includes independent verification of a statistically significant proportion of the energy efficiency improvement measures.\",\n          \"poliana:hasRequirement\": [\n            {\n              \"@type\": \"poliana:Requirement\",\n              \"schema:name\": \"Control System\",\n              \"schema:description\": \"A control system must be put in place that includes independent verification of a statistically significant proportion of the energy efficiency improvement measures.\"\n            }\n          ]\n        },\n        {\n          \"@type\": \"poliana:SubSection\",\n          \"schema:name\": \"Publication of Energy Savings Data\",\n          \"schema:description\": \"Member States must publish data on the annual trend of energy savings annually.\",\n          \"poliana:hasRequirement\": [\n            {\n              \"@type\": \"poliana:Requirement\",\n              \"schema:name\": \"Data Publication\",\n              \"schema:description\": \"Data on the annual trend of energy savings must be published annually.\"\n            }\n          ]\n        }\n      ]\n    },\n    {\n      \"@type\": \"poliana:Section\",\n      \"schema:name\": \"Alternative Policy Measures\",\n      \"schema:description\": \"Member States may implement alternative policy measures to achieve the required energy savings if they can demonstrate that these measures are at least as effective as obligation schemes.\",\n      \"poliana:hasSubSection\": [\n        {\n          \"@type\": \"poliana:SubSection\",\n          \"schema:name\": \"Demonstration of Effectiveness\",\n          \"schema:description\": \"Member States must demonstrate that alternative policy measures are at least as effective as obligation schemes in achieving the required energy savings.\",\n          \"poliana:hasRequirement\": [\n            {\n              \"@type\": \"poliana:Requirement\",\n              \"schema:name\": \"Effectiveness Demonstration\",\n              \"schema:description\": \"Alternative policy measures must be demonstrated to be at least as effective as obligation schemes in achieving the required energy savings.\"\n            }\n          ]\n        },\n        {\n          \"@type\": \"poliana:SubSection\",\n          \"schema:name\": \"Energy Savings Calculation Methods\",\n          \"schema:description\": \"Member States must use the methods and principles provided in points (1) and (2) of Annex V to calculate energy savings achieved through alternative policy measures.\",\n          \"poliana:hasRequirement\": [\n            {\n              \"@type\": \"poliana:Requirement\",\n              \"schema:name\": \"Calculation Method\",\n              \"schema:description\": \"Energy savings must be calculated using the methods and principles provided in points (1) and (2) of Annex V.\"\n            }\n          ]\n        },\n        {\n          \"@type\": \"poliana:SubSection\",\n          \"schema:name\": \"Verification of Energy Savings\",\n          \"schema:description\": \"Member States must verify that energy savings achieved through alternative policy measures are accurately calculated.\",\n          \"poliana:hasRequirement\": [\n            {\n              \"@type\": \"poliana:Requirement\",\n              \"schema:name\": \"Energy Savings Verification\",\n              \"schema:description\": \"Energy savings achieved through alternative policy measures must be verified to ensure accuracy.\"\n            }\n          ]\n        },\n        {\n          \"@type\": \"poliana:SubSection\",\n          \"schema:name\": \"Publication of Energy Savings Data\",\n          \"schema:description\": \"Member States must publish data on the energy savings achieved through alternative policy measures annually.\",\n          \"poliana:hasRequirement\": [\n            {\n              \"@type\": \"poliana:Requirement\",\n              \"schema:name\": \"Data Publication\",\n              \"schema:description\": \"Data on the energy savings achieved through alternative policy measures must be published annually.\"\n            }\n          ]\n        }\n      ]\n    },\n    {\n      \"@type\": \"poliana:Section\",\n      \"schema:name\": \"Monitoring and Reporting\",\n      \"schema:description\": \"Member States must monitor and report on their progress in achieving the required energy savings.\",\n      \"poliana:hasSubSection\": [\n        {\n          \"@type\": \"poliana:SubSection\",\n          \"schema:name\": \"Progress Monitoring\",\n          \"schema:description\": \"Member States must regularly monitor their progress in achieving the required energy savings.\",\n          \"poliana:hasRequirement\": [\n            {\n              \"@type\": \"poliana:Requirement\",\n              \"schema:name\": \"Regular Monitoring\",\n              \"schema:description\": \"Member States must regularly monitor their progress in achieving the required energy savings.\"\n            }\n          ]\n        },\n        {\n          \"@type\": \"poliana:SubSection\",\n          \"schema:name\": \"Reporting Requirements\",\n          \"schema:description\": \"Member States must submit annual reports to the European Commission on their progress in achieving the required energy savings.\",\n          \"poliana:hasRequirement\": [\n            {\n              \"@type\": \"poliana:Requirement\",\n              \"schema:name\": \"Annual Reporting\",\n              \"schema:description\": \"Member States must submit annual reports to the European Commission on their progress in achieving the required energy savings.\"\n            }\n          ]\n        },\n        {\n          \"@type\": \"poliana:SubSection\",\n          \"schema:name\": \"Data Collection and Analysis\",\n          \"schema:description\": \"Member States must collect and analyze data on energy consumption and efficiency to inform their monitoring and reporting efforts.\",\n          \"poliana:hasRequirement\": [\n            {\n              \"@type\": \"poliana:Requirement\",\n              \"schema:name\": \"Data Collection and Analysis\",\n              \"schema:description\": \"Member States must collect and analyze data on energy consumption and efficiency to inform their monitoring and reporting efforts.\"\n            }\n          ]\n        },\n        {\n          \"@type\": \"poliana:SubSection\",\n          \"schema:name\": \"Transparency and Accountability\",\n          \"schema:description\": \"Member States must ensure transparency and accountability in their monitoring and reporting efforts.\",\n          \"poliana:hasRequirement\": [\n            {\n              \"@type\": \"poliana:Requirement\",\n              \"schema:name\": \"Transparency and Accountability\",\n              \"schema:description\": \"Member States must ensure transparency and accountability in their monitoring and reporting efforts.\"\n            }\n          ]\n        }\n      ]\n    },\n    {\n      \"@type\": \"poliana:Section\",\n      \"schema:name\": \"Compliance and Enforcement\",\n      \"schema:description\": \"The European Commission will monitor Member States' compliance with the requirements of this directive and take appropriate enforcement action if necessary.\",\n      \"poliana:hasSubSection\": [\n        {\n          \"@type\": \"poliana:SubSection\",\n          \"schema:name\": \"Monitoring Compliance\",\n          \"schema:description\": \"The European Commission will regularly monitor Member States' compliance with the requirements of this directive.\",\n          \"poliana:hasRequirement\": [\n            {\n              \"@type\": \"poliana:Requirement\",\n              \"schema:name\": \"Regular Monitoring\",\n              \"schema:description\": \"The European Commission will regularly monitor Member States' compliance with the requirements of this directive.\"\n            }\n          ]\n        },\n        {\n          \"@type\": \"poliana:SubSection\",\n          \"schema:name\": \"Enforcement Action\",\n          \"schema:description\": \"The European Commission may take appropriate enforcement action against Member States that fail to comply with the requirements of this directive.\",\n          \"poliana:hasRequirement\": [\n            {\n              \"@type\": \"poliana:Requirement\",\n              \"schema:name\": \"Enforcement Action\",\n              \"schema:description\": \"The European Commission may take appropriate enforcement action against Member States that fail to comply with the requirements of this directive.\"\n            }\n          ]\n        },\n        {\n          \"@type\": \"poliana:SubSection\",\n          \"schema:name\": \"Sanctions and Penalties\",\n          \"schema:description\": \"Member States that fail to comply with the requirements of this directive may be subject to sanctions or penalties.\",\n          \"poliana:hasRequirement\": [\n            {\n              \"@type\": \"poliana:Requirement\",\n              \"schema:name\": \"Sanctions and Penalties\",\n              \"schema:description\": \"Member States that fail to comply with the requirements of this directive may be subject to sanctions or penalties.\"\n            }\n          ]\n        },\n        {\n          \"@type\": \"poliana:SubSection\",\n          \"schema:name\": \"Appeals Process\",\n          \"schema:description\": \"Member States have the right to appeal any enforcement action taken against them by the European Commission.\",\n          \"poliana:hasRequirement\": [\n            {\n              \"@type\": \"poliana:Requirement\",\n              \"schema:name\": \"Appeals Process\",\n              \"schema:description\": \"Member States have the right to appeal any enforcement action taken against them by the European Commission.\"\n            }\n          ]\n        }\n      ]\n    }\n  ]\n}\n```json\n{\n  \"directive_title\": \"Energy Efficiency Directive\",\n  \"objective\": \"To improve energy efficiency in buildings and reduce greenhouse gas emissions.\",\n  \"scope\": \"Applies to all new buildings and existing buildings undergoing major renovations within the European Union.\",\n  \"requirements\": [\n    {\n      \"section\": \"Building Design and Construction\",\n      \"details\": [\n        \"All new buildings must meet minimum energy performance standards (MEPS).\",\n        \"Buildings undergoing major renovations must also comply with MEPS for the renovated parts.\"\n      ]\n    },\n    {\n      \"section\": \"Energy Performance Certificates\",\n      \"details\": [\n        \"Energy performance certificates (EPCs) must be issued for all buildings.\",\n        \"EPCs must include information on energy consumption, efficiency measures, and potential savings.\"\n      ]\n    },\n    {\n      \"section\": \"Renovation Obligations\",\n      \"details\": [\n        \"Buildings with an EPC rating below a certain threshold must undergo renovations to improve their energy performance.\",\n        \"The specific requirements for these renovations are outlined in the directive.\"\n      ]\n    },\n    {\n      \"section\": \"Monitoring and Reporting\",\n      \"details\": [\n        \"Member States must monitor and report on progress towards meeting energy efficiency targets.\",\n        \"Annual reports must be submitted to the European Commission detailing actions taken and results achieved.\"\n      ]\n    }\n  ],\n  \"compliance_and_enforcement\": {\n    \"monitoring\": \"The European Commission will regularly monitor compliance with the directive.\",\n    \"enforcement\": \"Enforcement action may include fines or other penalties for non-compliance.\",\n    \"appeals\": \"Member States have the right to appeal any enforcement decisions.\"\n  }\n}\n```\n\nThis JSON structure provides a clear and detailed overview of an Energy Efficiency Directive, including its title, objective, scope, specific requirements in various sections such as building design, energy performance certificates, renovation obligations, and monitoring/reporting. It also outlines the compliance and enforcement mechanisms that ensure adherence to the directive's provisions.",
  "generation_time": 185.5838770866394,
  "output": "jsonld\n{\n  \"@context\": {\n    \"poliana\": \"http://example.org/poliana#\",\n    \"schema\": \"http://schema.org/\",\n    \"rdfs\": \"http://www.w3.org/2000/01/rdf-schema#\"\n  },\n  \"@type\": \"poliana:Article\",\n  \"schema:name\": \"Energy Efficiency Obligation Schemes and Alternative Policy Measures\",\n  \"schema:description\": \"This article outlines the requirements for Member States to implement energy efficiency obligation schemes or alternative policy measures to achieve specific levels of energy savings by 2020.\",\n  \"poliana:hasSection\": [\n    {\n      \"@type\": \"poliana:Section\",\n      \"schema:name\": \"Obligation Schemes\",\n      \"schema:description\": \"Member States must implement obligation schemes that lead to the achievement of at least 1.5% annual energy savings in the period from 2014 to 2020.\",\n      \"poliana:hasSubSection\": [\n        {\n          \"@type\": \"poliana:SubSection\",\n          \"schema:name\": \"Exclusions and Adjustments\",\n          \"schema:description\": \"Obligation schemes do not apply to energy savings achieved through the application of mandatory EU law or through individual actions by final consumers.\",\n          \"poliana:hasRequirement\": [\n            {\n              \"@type\": \"poliana:Requirement\",\n              \"schema:name\": \"Exclusion of Mandatory EU Law Savings\",\n              \"schema:description\": \"Energy savings achieved through the application of mandatory EU law are excluded from the obligation schemes.\"\n            },\n            {\n              \"@type\": \"poliana:Requirement\",\n              \"schema:name\": \"Exclusion of Individual Actions by Final Consumers\",\n              \"schema:description\": \"Energy savings achieved through individual actions by final consumers are excluded from the obligation schemes.\"\n            }\n          ]\n        },\n        {\n          \"@type\": \"poliana:SubSection\",\n          \"schema:name\": \"Adjustments for Energy Savings Achieved Through Individual Actions\",\n          \"schema:description\": \"Member States may adjust the energy savings target downwards to account for energy savings achieved through individual actions by final consumers.\",\n          \"poliana:hasRequirement\": [\n            {\n              \"@type\": \"poliana:Requirement\",\n              \"schema:name\": \"Adjustment Mechanism\",\n              \"schema:description\": \"The adjustment mechanism must be transparent and verifiable.\"\n            }\n          ]\n        },\n        {\n          \"@type\": \"poliana:SubSection\",\n          \"schema:name\": \"Exclusions for Energy Savings Achieved Through Mandatory EU Law\",\n          \"schema:description\": \"Energy savings achieved through the application of mandatory EU law are excluded from the obligation schemes.\",\n          \"poliana:hasRequirement\": [\n            {\n              \"@type\": \"poliana:Requirement\",\n              \"schema:name\": \"Exclusion Mechanism\",\n              \"schema:description\": \"The exclusion mechanism must be transparent and verifiable.\"\n            }\n          ]\n        },\n        {\n          \"@type\": \"poliana:SubSection\",\n          \"schema:name\": \"Energy Savings Target Adjustments\",\n          \"schema:description\": \"Member States may adjust the energy savings target downwards to account for energy savings achieved through individual actions by final consumers.\",\n          \"poliana:hasRequirement\": [\n            {\n              \"@type\": \"poliana:Requirement\",\n              \"schema:name\": \"Adjustment Mechanism\",\n              \"schema:description\": \"The adjustment mechanism must be transparent and verifiable.\"\n            }\n          ]\n        },\n        {\n          \"@type\": \"poliana:SubSection\",\n          \"schema:name\": \"Energy Savings Calculation Methods\",\n          \"schema:description\": \"Member States must use the methods and principles provided in points (1) and (2) of Annex V to calculate energy savings.\",\n          \"poliana:hasRequirement\": [\n            {\n              \"@type\": \"poliana:Requirement\",\n              \"schema:name\": \"Calculation Method\",\n              \"schema:description\": \"Energy savings must be calculated using the methods and principles provided in points (1) and (2) of Annex V.\"\n            }\n          ]\n        },\n        {\n          \"@type\": \"poliana:SubSection\",\n          \"schema:name\": \"Verification of Energy Savings\",\n          \"schema:description\": \"Member States must put in place a control system that includes independent verification of a statistically significant proportion of the energy efficiency improvement measures.\",\n          \"poliana:hasRequirement\": [\n            {\n              \"@type\": \"poliana:Requirement\",\n              \"schema:name\": \"Control System\",\n              \"schema:description\": \"A control system must be put in place that includes independent verification of a statistically significant proportion of the energy efficiency improvement measures.\"\n            }\n          ]\n        },\n        {\n          \"@type\": \"poliana:SubSection\",\n          \"schema:name\": \"Publication of Energy Savings Data\",\n          \"schema:description\": \"Member States must publish data on the annual trend of energy savings annually.\",\n          \"poliana:hasRequirement\": [\n            {\n              \"@type\": \"poliana:Requirement\",\n              \"schema:name\": \"Data Publication\",\n              \"schema:description\": \"Data on the annual trend of energy savings must be published annually.\"\n            }\n          ]\n        },\n        {\n          \"@type\": \"poliana:SubSection\",\n          \"schema:name\": \"Exclusions and Adjustments for Energy Savings Achieved Through Individual Actions\",\n          \"schema:description\": \"Member States may adjust the energy savings target downwards to account for energy savings achieved through individual actions by final consumers.\",\n          \"poliana:hasRequirement\": [\n            {\n              \"@type\": \"poliana:Requirement\",\n              \"schema:name\": \"Adjustment Mechanism\",\n              \"schema:description\": \"The adjustment mechanism must be transparent and verifiable.\"\n            }\n          ]\n        },\n        {\n          \"@type\": \"poliana:SubSection\",\n          \"schema:name\": \"Exclusions for Energy Savings Achieved Through Mandatory EU Law\",\n          \"schema:description\": \"Energy savings achieved through the application of mandatory EU law are excluded from the obligation schemes.\",\n          \"poliana:hasRequirement\": [\n            {\n              \"@type\": \"poliana:Requirement\",\n              \"schema:name\": \"Exclusion Mechanism\",\n              \"schema:description\": \"The exclusion mechanism must be transparent and verifiable.\"\n            }\n          ]\n        },\n        {\n          \"@type\": \"poliana:SubSection\",\n          \"schema:name\": \"Energy Savings Target Adjustments\",\n          \"schema:description\": \"Member States may adjust the energy savings target downwards to account for energy savings achieved through individual actions by final consumers.\",\n          \"poliana:hasRequirement\": [\n            {\n              \"@type\": \"poliana:Requirement\",\n              \"schema:name\": \"Adjustment Mechanism\",\n              \"schema:description\": \"The adjustment mechanism must be transparent and verifiable.\"\n            }\n          ]\n        },\n        {\n          \"@type\": \"poliana:SubSection\",\n          \"schema:name\": \"Energy Savings Calculation Methods\",\n          \"schema:description\": \"Member States must use the methods and principles provided in points (1) and (2) of Annex V to calculate energy savings.\",\n          \"poliana:hasRequirement\": [\n            {\n              \"@type\": \"poliana:Requirement\",\n              \"schema:name\": \"Calculation Method\",\n              \"schema:description\": \"Energy savings must be calculated using the methods and principles provided in points (1) and (2) of Annex V.\"\n            }\n          ]\n        },\n        {\n          \"@type\": \"poliana:SubSection\",\n          \"schema:name\": \"Verification of Energy Savings\",\n          \"schema:description\": \"Member States must put in place a control system that includes independent verification of a statistically significant proportion of the energy efficiency improvement measures.\",\n          \"poliana:hasRequirement\": [\n            {\n              \"@type\": \"poliana:Requirement\",\n              \"schema:name\": \"Control System\",\n              \"schema:description\": \"A control system must be put in place that includes independent verification of a statistically significant proportion of the energy efficiency improvement measures.\"\n            }\n          ]\n        },\n        {\n          \"@type\": \"poliana:SubSection\",\n          \"schema:name\": \"Publication of Energy Savings Data\",\n          \"schema:description\": \"Member States must publish data on the annual trend of energy savings annually.\",\n          \"poliana:hasRequirement\": [\n            {\n              \"@type\": \"poliana:Requirement\",\n              \"schema:name\": \"Data Publication\",\n              \"schema:description\": \"Data on the annual trend of energy savings must be published annually.\"\n            }\n          ]\n        }\n      ]\n    },\n    {\n      \"@type\": \"poliana:Section\",\n      \"schema:name\": \"Alternative Policy Measures\",\n      \"schema:description\": \"Member States may implement alternative policy measures to achieve the required energy savings if they can demonstrate that these measures are at least as effective as obligation schemes.\",\n      \"poliana:hasSubSection\": [\n        {\n          \"@type\": \"poliana:SubSection\",\n          \"schema:name\": \"Demonstration of Effectiveness\",\n          \"schema:description\": \"Member States must demonstrate that alternative policy measures are at least as effective as obligation schemes in achieving the required energy savings.\",\n          \"poliana:hasRequirement\": [\n            {\n              \"@type\": \"poliana:Requirement\",\n              \"schema:name\": \"Effectiveness Demonstration\",\n              \"schema:description\": \"Alternative policy measures must be demonstrated to be at least as effective as obligation schemes in achieving the required energy savings.\"\n            }\n          ]\n        },\n        {\n          \"@type\": \"poliana:SubSection\",\n          \"schema:name\": \"Energy Savings Calculation Methods\",\n          \"schema:description\": \"Member States must use the methods and principles provided in points (1) and (2) of Annex V to calculate energy savings achieved through alternative policy measures.\",\n          \"poliana:hasRequirement\": [\n            {\n              \"@type\": \"poliana:Requirement\",\n              \"schema:name\": \"Calculation Method\",\n              \"schema:description\": \"Energy savings must be calculated using the methods and principles provided in points (1) and (2) of Annex V.\"\n            }\n          ]\n        },\n        {\n          \"@type\": \"poliana:SubSection\",\n          \"schema:name\": \"Verification of Energy Savings\",\n          \"schema:description\": \"Member States must verify that energy savings achieved through alternative policy measures are accurately calculated.\",\n          \"poliana:hasRequirement\": [\n            {\n              \"@type\": \"poliana:Requirement\",\n              \"schema:name\": \"Energy Savings Verification\",\n              \"schema:description\": \"Energy savings achieved through alternative policy measures must be verified to ensure accuracy.\"\n            }\n          ]\n        },\n        {\n          \"@type\": \"poliana:SubSection\",\n          \"schema:name\": \"Publication of Energy Savings Data\",\n          \"schema:description\": \"Member States must publish data on the energy savings achieved through alternative policy measures annually.\",\n          \"poliana:hasRequirement\": [\n            {\n              \"@type\": \"poliana:Requirement\",\n              \"schema:name\": \"Data Publication\",\n              \"schema:description\": \"Data on the energy savings achieved through alternative policy measures must be published annually.\"\n            }\n          ]\n        }\n      ]\n    },\n    {\n      \"@type\": \"poliana:Section\",\n      \"schema:name\": \"Monitoring and Reporting\",\n      \"schema:description\": \"Member States must monitor and report on their progress in achieving the required energy savings.\",\n      \"poliana:hasSubSection\": [\n        {\n          \"@type\": \"poliana:SubSection\",\n          \"schema:name\": \"Progress Monitoring\",\n          \"schema:description\": \"Member States must regularly monitor their progress in achieving the required energy savings.\",\n          \"poliana:hasRequirement\": [\n            {\n              \"@type\": \"poliana:Requirement\",\n              \"schema:name\": \"Regular Monitoring\",\n              \"schema:description\": \"Member States must regularly monitor their progress in achieving the required energy savings.\"\n            }\n          ]\n        },\n        {\n          \"@type\": \"poliana:SubSection\",\n          \"schema:name\": \"Reporting Requirements\",\n          \"schema:description\": \"Member States must submit annual reports to the European Commission on their progress in achieving the required energy savings.\",\n          \"poliana:hasRequirement\": [\n            {\n              \"@type\": \"poliana:Requirement\",\n              \"schema:name\": \"Annual Reporting\",\n              \"schema:description\": \"Member States must submit annual reports to the European Commission on their progress in achieving the required energy savings.\"\n            }\n          ]\n        },\n        {\n          \"@type\": \"poliana:SubSection\",\n          \"schema:name\": \"Data Collection and Analysis\",\n          \"schema:description\": \"Member States must collect and analyze data on energy consumption and efficiency to inform their monitoring and reporting efforts.\",\n          \"poliana:hasRequirement\": [\n            {\n              \"@type\": \"poliana:Requirement\",\n              \"schema:name\": \"Data Collection and Analysis\",\n              \"schema:description\": \"Member States must collect and analyze data on energy consumption and efficiency to inform their monitoring and reporting efforts.\"\n            }\n          ]\n        },\n        {\n          \"@type\": \"poliana:SubSection\",\n          \"schema:name\": \"Transparency and Accountability\",\n          \"schema:description\": \"Member States must ensure transparency and accountability in their monitoring and reporting efforts.\",\n          \"poliana:hasRequirement\": [\n            {\n              \"@type\": \"poliana:Requirement\",\n              \"schema:name\": \"Transparency and Accountability\",\n              \"schema:description\": \"Member States must ensure transparency and accountability in their monitoring and reporting efforts.\"\n            }\n          ]\n        }\n      ]\n    },\n    {\n      \"@type\": \"poliana:Section\",\n      \"schema:name\": \"Compliance and Enforcement\",\n      \"schema:description\": \"The European Commission will monitor Member States' compliance with the requirements of this directive and take appropriate enforcement action if necessary.\",\n      \"poliana:hasSubSection\": [\n        {\n          \"@type\": \"poliana:SubSection\",\n          \"schema:name\": \"Monitoring Compliance\",\n          \"schema:description\": \"The European Commission will regularly monitor Member States' compliance with the requirements of this directive.\",\n          \"poliana:hasRequirement\": [\n            {\n              \"@type\": \"poliana:Requirement\",\n              \"schema:name\": \"Regular Monitoring\",\n              \"schema:description\": \"The European Commission will regularly monitor Member States' compliance with the requirements of this directive.\"\n            }\n          ]\n        },\n        {\n          \"@type\": \"poliana:SubSection\",\n          \"schema:name\": \"Enforcement Action\",\n          \"schema:description\": \"The European Commission may take appropriate enforcement action against Member States that fail to comply with the requirements of this directive.\",\n          \"poliana:hasRequirement\": [\n            {\n              \"@type\": \"poliana:Requirement\",\n              \"schema:name\": \"Enforcement Action\",\n              \"schema:description\": \"The European Commission may take appropriate enforcement action against Member States that fail to comply with the requirements of this directive.\"\n            }\n          ]\n        },\n        {\n          \"@type\": \"poliana:SubSection\",\n          \"schema:name\": \"Sanctions and Penalties\",\n          \"schema:description\": \"Member States that fail to comply with the requirements of this directive may be subject to sanctions or penalties.\",\n          \"poliana:hasRequirement\": [\n            {\n              \"@type\": \"poliana:Requirement\",\n              \"schema:name\": \"Sanctions and Penalties\",\n              \"schema:description\": \"Member States that fail to comply with the requirements of this directive may be subject to sanctions or penalties.\"\n            }\n          ]\n        },\n        {\n          \"@type\": \"poliana:SubSection\",\n          \"schema:name\": \"Appeals Process\",\n          \"schema:description\": \"Member States have the right to appeal any enforcement action taken against them by the European Commission.\",\n          \"poliana:hasRequirement\": [\n            {\n              \"@type\": \"poliana:Requirement\",\n              \"schema:name\": \"Appeals Process\",\n              \"schema:description\": \"Member States have the right to appeal any enforcement action taken against them by the European Commission.\"\n            }\n          ]\n        }\n      ]\n    }\n  ]\n}\n```json\n{\n  \"directive_title\": \"Energy Efficiency Directive\",\n  \"objective\": \"To improve energy efficiency in buildings and reduce greenhouse gas emissions.\",\n  \"scope\": \"Applies to all new buildings and existing buildings undergoing major renovations within the European Union.\",\n  \"requirements\": [\n    {\n      \"section\": \"Building Design and Construction\",\n      \"details\": [\n        \"All new buildings must meet minimum energy performance standards (MEPS).\",\n        \"Buildings undergoing major renovations must also comply with MEPS for the renovated parts.\"\n      ]\n    },\n    {\n      \"section\": \"Energy Performance Certificates\",\n      \"details\": [\n        \"Energy performance certificates (EPCs) must be issued for all buildings.\",\n        \"EPCs must include information on energy consumption, efficiency measures, and potential savings.\"\n      ]\n    },\n    {\n      \"section\": \"Renovation Obligations\",\n      \"details\": [\n        \"Buildings with an EPC rating below a certain threshold must undergo renovations to improve their energy performance.\",\n        \"The specific requirements for these renovations are outlined in the directive.\"\n      ]\n    },\n    {\n      \"section\": \"Monitoring and Reporting\",\n      \"details\": [\n        \"Member States must monitor and report on progress towards meeting energy efficiency targets.\",\n        \"Annual reports must be submitted to the European Commission detailing actions taken and results achieved.\"\n      ]\n    }\n  ],\n  \"compliance_and_enforcement\": {\n    \"monitoring\": \"The European Commission will regularly monitor compliance with the directive.\",\n    \"enforcement\": \"Enforcement action may include fines or other penalties for non-compliance.\",\n    \"appeals\": \"Member States have the right to appeal any enforcement decisions.\"\n  }\n}\n```\n\nThis JSON structure provides a clear and detailed overview of an Energy Efficiency Directive, including its title, objective, scope, specific requirements in various sections such as building design, energy performance certificates, renovation obligations, and monitoring/reporting. It also outlines the compliance and enforcement mechanisms that ensure adherence to the directive's provisions.",
  "success": true,
  "metadata": {
    "policy_info": {
      "Titel": "EU_32012L0027_Title_0_Chapter_2_Section_0_Article_07",
      "CELEX_Number": "32012L0027",
      "ELI": "http://data.europa.eu/eli/dir/2012/27/oj",
      "Annotators": [
        "C",
        "F"
      ]
    },
    "prompt_strategy": "one-shot",
    "output_format": "json-ld",
    "model": "qwen2.5-coder:32b",
    "timestamp": "2025-04-21T20:45:24.959336"
  },
  "triple_count": 0
}